NR	FILENR	ID	SYMBOL	USE	TRACE	RU	PL
102940	3183	246185	DIA_WAPPEN_HANTZ_MIR_LOCKPICKNEIN	INFO_ADDCHOICE.PAR1	INFO_ADDCHOICE.PAR1	袧械褌, 械褖械 薪械褌.	Nie, jeszcze nie.
102941	3183	246186	DIA_WAPPEN_HANTZ_MIR_LOCKPICKNEIN	INFO_ADDCHOICE.PAR1	INFO_ADDCHOICE.PAR1	袛邪, 胁芯褌 芯薪芯.	Tak, oto ono.
102942	-1	74348	DIA_WAPPEN_HANTZ_MIR_LOCKPICKJA	"AI_OUTPUT(OTHER,SELF,""DIA_WAPPEN_Hantz_Mir_Lockpickja_15_01"")"	SUBTITLE	袚写械 屑薪械 胁蟹褟褌褜 褋褘褉褜械?	膫盲暮 臎铆暮 芒莽藱艌眉 艅疟膽眉暮?
102943	-1	74348	DIA_WAPPEN_HANTZ_MIR_LOCKPICKJA	"AI_OUTPUT(SELF,OTHER,""DIA_WAPPEN_Hantz_Mir_Lockpickja_01_01"")"	SUBTITLE	(褍谢褘斜邪褟褋褜) 袦芯卸械褕褜 泻褍锌懈褌褜. 袠谢懈 锌芯褉褘褌褜褋褟 胁 褏谢邪屑械 胁芯蟹谢械 写芯屑芯胁 懈谢懈 锌械褉械写 谐芯褉芯写芯屑..	(贸毛疟谩艜藱艅眉) 臍卯膰暮艡眉 臋贸膹膷艌眉. 膶毛膷 膹卯膽疟艌眉艅藱 芒 艖毛艜臎暮 芒卯莽毛暮 盲卯臎卯芒 膷毛膷 膹暮膽暮盲 膬卯膽卯盲卯臎..
102944	-1	74349	DIA_WAPPEN_HANTZ_MIR_NOGIVELOCKPICK	"AI_OUTPUT(OTHER,SELF,""DIA_WAPPEN_Hantz_Mir_NoGiveLockpick_15_01"")"	SUBTITLE	袧械褌, 械褖械 薪械 褋写械谢邪谢.	脥暮艌, 暮暖暮 铆暮 艅盲暮毛艜毛.
102945	-1	74349	DIA_WAPPEN_HANTZ_MIR_NOGIVELOCKPICK	"AI_OUTPUT(SELF,OTHER,""DIA_WAPPEN_Hantz_Mir_NoGiveLockpick_01_01"")"	SUBTITLE	孝芯谐写邪 写械谢邪泄 斜褘褋褌褉械械. 校 屑械薪褟 蟹邪泻邪蟹 胁懈褋懈褌.	艊卯膬盲艜 盲暮毛艜茅 谩疟艅艌膽暮暮. 脫 臎暮铆藱 莽艜臋艜莽 芒膷艅膷艌.
102946	-1	74350	DIA_WAPPEN_HANTZ_MIR_GIVELOCKPICK	"AI_OUTPUT(OTHER,SELF,""DIA_WAPPEN_Hantz_Mir_GiveLockpick_15_01"")"	SUBTITLE	袛邪, 胁芯褌 芯薪懈.	Tak, oto one.
102947	-1	74350	DIA_WAPPEN_HANTZ_MIR_GIVELOCKPICK	"AI_OUTPUT(SELF,OTHER,""DIA_WAPPEN_Hantz_Mir_GiveLockpick_01_01"")"	SUBTITLE	袨褌谢懈褔薪芯. 孝褘 褋褝泻芯薪芯屑懈谢 屑薪械 胁褉械屑褟 懈 褍褋懈谢懈褟. 小泻邪卸懈 袚懈谢写邪褋褍, 褔褌芯 褟 芯褌写邪谢 褌械斜械 褋胁芯泄 谐芯谢芯褋.	Doskonale. 艊疟 艅媒臋卯铆卯臎膷毛 臎铆暮 芒膽暮臎藱 膷 贸艅膷毛膷藱. 艃臋艜膰膷 膫膷毛盲艜艅贸, 梅艌卯 藱 卯艌盲艜毛 艌暮谩暮 艅芒卯茅 膬卯毛卯艅.
102948	3183	246198	DIA_WAPPEN_HANTZ_MIR_GIVELOCKPICK	B_LOGENTRY.ENTRY	LOG_ADDENTRY.PAR1	校 屑械薪褟 械褋褌褜 芯写芯斜褉械薪懈械 啸邪薪褑邪 斜谢邪谐芯写邪褉褟 芯褌屑褘褔泻邪屑.	脫 臎暮铆藱 暮艅艌眉 卯盲卯谩膽暮铆膷暮 艕艜铆枚艜 谩毛艜膬卯盲艜膽藱 卯艌臎疟梅臋艜臎.
103014	-1	74387	DIA_HANTZ_ABOUTMATERIAL_INFO	"AI_OUTPUT(SELF,OTHER,""DIA_HANTZ_AboutMaterial_06_01"")"	SUBTITLE	袙褋褌褉械褔邪谢褋褟, 薪芯 胁械褋褜 懈蟹褉邪褋褏芯写芯胁邪谢褋褟.	脗艅艌膽暮梅艜毛艅藱, 铆卯 芒暮艅眉 膷莽膽艜艅艖卯盲卯芒艜毛艅藱.
103043	3184	246293	DIA_WAPPEN_HILGER_STECKST_JA	INFO_ADDCHOICE.PAR1	INFO_ADDCHOICE.PAR1	携 谢懈褔薪芯 褍写芯褋褌芯胁械褉褞褋褜, 褔褌芯 褌褘 芯泻邪卸械褕褜褋褟 蟹邪 褉械褕械褌泻芯泄.	Zadbam o to, aby艣 poszed艂 do wi臋zienia.
103044	3184	246294	DIA_WAPPEN_HILGER_STECKST_JA	INFO_ADDCHOICE.PAR1	INFO_ADDCHOICE.PAR1	啸芯褉芯褕芯, 褟 褌械斜褟 薪械 胁懈写械谢.	No dobrze, nigdy si臋 nie widzieli艣my.
103153	3187	246420	DIA_MORDRAG_ANTIDOT_INFO	B_STARTMISSION.FIRSTNOTE	LOG_ADDENTRY.PAR1	袦芯褉写褉邪谐邪 锌芯泻褍褋邪谢 褟写芯胁懈褌褘泄 胁邪褉邪薪. 袧械芯斜褏芯写懈屑芯 芯褌薪械褋褌懈 袪懈芯褉写懈邪薪褍 胁褘褉胁邪薪薪褘械 泻谢褘泻懈 褌胁邪褉懈 写谢褟 懈蟹谐芯褌芯胁谢械薪懈褟 锌褉芯褌懈胁芯褟写懈褟. 袙褉械屑褟 芯谐褉邪薪懈褔械薪芯 72 褔邪褋邪屑懈.	臍卯膽盲膽艜膬艜 膹卯臋贸艅艜毛 藱盲卯芒膷艌疟茅 芒艜膽艜铆. 脥暮卯谩艖卯盲膷臎卯 卯艌铆暮艅艌膷 膼膷卯膽盲膷艜铆贸 芒疟膽芒艜铆铆疟暮 臋毛疟臋膷 艌芒艜膽膷 盲毛藱 膷莽膬卯艌卯芒毛暮铆膷藱 膹膽卯艌膷芒卯藱盲膷藱. 脗膽暮臎藱 卯膬膽艜铆膷梅暮铆卯 72 梅艜艅艜臎膷.
103925	-1	74789	DIA_EX_JAKOB_HI_MEAT	"AI_OUTPUT(SELF,OTHER,""DIA_Ex_Jakob_hi_meat_06_03"")"	SUBTITLE	袩褉懈薪械褋懈 薪械 屑械薪褜褕械 20 褏芯褉芯褕懈褏 泻褍褋泻芯胁 屑褟褋邪 锌邪写邪谢褜褖懈泻邪 懈谢懈 泻褉芯褌芯泻褉褘褋邪.	膸膽膷铆暮艅膷 铆暮 臎暮铆眉艡暮 20 艖卯膽卯艡膷艖 臋贸艅臋卯芒 臎藱艅艜 膹艜盲艜毛眉暖膷臋艜 膷毛膷 臋膽卯艌卯臋膽疟艅艜.
103926	3194	247243	DIA_EX_JAKOB_HI_MEAT	B_STARTMISSION.FIRSTNOTE	LOG_ADDENTRY.PAR1	携泻芯斜褍 薪邪 泻褍褏薪褞 薪褍卸薪芯 20 泻褍褋泻芯胁 屑褟褋邪 锌邪写邪谢褜褖懈泻邪 懈谢懈 泻褉芯褌芯泻褉褘褋邪. 啸芯褌褜 褝褌芯 懈 薪械 褋褉芯褔薪芯, 褟 胁褋械 卸械 褉械褕懈谢 锌芯屑芯褔褜, 邪 褌芯 芯褏芯褌薪懈泻懈 胁 泻褉械锌芯褋褌懈 褋芯胁褋械屑 芯斜谢械薪懈谢懈褋褜.	脽臋卯谩贸 铆艜 臋贸艖铆牛 铆贸膰铆卯 20 臋贸艅臋卯芒 臎藱艅艜 膹艜盲艜毛眉暖膷臋艜 膷毛膷 臋膽卯艌卯臋膽疟艅艜. 艕卯艌眉 媒艌卯 膷 铆暮 艅膽卯梅铆卯, 藱 芒艅暮 膰暮 膽暮艡膷毛 膹卯臎卯梅眉, 艜 艌卯 卯艖卯艌铆膷臋膷 芒 臋膽暮膹卯艅艌膷 艅卯芒艅暮臎 卯谩毛暮铆膷毛膷艅眉.
104333	-1	74954	DIA_EX_MIRKO_HI_NICHTDICHT	"AI_OUTPUT(OTHER,SELF,""DIA_EX_Mirko_Hi_nichtdicht_15_00"")"	SUBTITLE	袧械 谐芯胁芯褉懈 械褉褍薪写褍.	Nie gadaj bzdur.
104334	-1	74954	DIA_EX_MIRKO_HI_NICHTDICHT	"AI_OUTPUT(SELF,OTHER,""DIA_EX_Mirko_Hi_nichtdicht_03_01"")"	SUBTITLE	袧械褌, 褝褌芯 锌褉邪胁写邪.	脥暮艌, 媒艌卯 膹膽艜芒盲艜.
104335	-1	74954	DIA_EX_MIRKO_HI_NICHTDICHT	"AI_OUTPUT(SELF,OTHER,""DIA_EX_Mirko_Hi_nichtdicht_03_02"")"	SUBTITLE	袥邪写薪芯, 褟 锌芯泄写褍 芯写懈薪.	脣艜盲铆卯, 藱 膹卯茅盲贸 卯盲膷铆.
104336	-1	74954	DIA_EX_MIRKO_HI_NICHTDICHT	"AI_OUTPUT(SELF,OTHER,""DIA_EX_Mirko_Hi_nichtdicht_03_03"")"	SUBTITLE	袧邪写械褞褋褜, 芯薪懈 屑械薪褟 薪械 胁懈写褟褌.	脥艜盲暮牛艅眉, 卯铆膷 臎暮铆藱 铆暮 芒膷盲藱艌.
104337	-1	74954	DIA_EX_MIRKO_HI_NICHTDICHT	"AI_OUTPUT(OTHER,SELF,""DIA_EX_Mirko_Hi_nichtdicht_15_04"")"	SUBTITLE	效褌芯 蟹邪 锌邪褉邪薪芯懈泻...	脳艌卯 莽艜 膹艜膽艜铆卯膷臋...
104338	3197	247667	DIA_EX_MIRKO_MADEIT_INFO	B_SUCCESSMISSION.LASTNODE	LOG_ADDENTRY.PAR1	携 锌褉懈胁械谢 袦懈褉泻芯 胁 械谐芯 锌械褖械褉褍.	脽 膹膽膷芒暮毛 臍膷膽臋卯 芒 暮膬卯 膹暮暖暮膽贸.
104339	-1	74957	DIA_EX_MIRKO_MADEIT_INFO	"AI_OUTPUT(SELF,OTHER,""DIA_EX_Mirko_madeit_03_00"")"	SUBTITLE	携 褋薪芯胁邪 褋斜械谐褍.	脽 艅铆卯芒艜 艅谩暮膬贸.
104340	-1	74957	DIA_EX_MIRKO_MADEIT_INFO	"AI_OUTPUT(SELF,OTHER,""DIA_EX_Mirko_madeit_03_01"")"	SUBTITLE	携 写芯谢卸械薪 锌褉芯写芯谢卸邪褌褜 褉邪斜芯褌邪褌褜 泻邪泻 芯斜褘褔薪芯, 懈薪邪褔械 芯薪懈 锌芯泄屑褍褌.	脽 盲卯毛膰暮铆 膹膽卯盲卯毛膰艜艌眉 膽艜谩卯艌艜艌眉 臋艜臋 卯谩疟梅铆卯, 膷铆艜梅暮 卯铆膷 膹卯茅臎贸艌.
104341	-1	74957	DIA_EX_MIRKO_MADEIT_INFO	"AI_OUTPUT(OTHER,SELF,""DIA_EX_Mirko_madeit_15_02"")"	SUBTITLE	孝芯, 泻邪泻 褌褘 褋械泄褔邪褋 胁械写械褕褜 褋械斜褟, 褍卸械 锌芯写芯蟹褉懈褌械谢褜薪芯.	艊卯, 臋艜臋 艌疟 艅暮茅梅艜艅 芒暮盲暮艡眉 艅暮谩藱, 贸膰暮 膹卯盲卯莽膽膷艌暮毛眉铆卯.
104342	-1	74957	DIA_EX_MIRKO_MADEIT_INFO	"AI_OUTPUT(OTHER,SELF,""DIA_EX_Mirko_madeit_15_03"")"	SUBTITLE	袛邪卸械 褋谢械锌芯泄 锌芯泄屑械褌, 褔褌芯 褌褘 锌邪褉邪薪芯懈泻.	脛艜膰暮 艅毛暮膹卯茅 膹卯茅臎暮艌, 梅艌卯 艌疟 膹艜膽艜铆卯膷臋.
104343	-1	74957	DIA_EX_MIRKO_MADEIT_INFO	"AI_OUTPUT(SELF,OTHER,""DIA_EX_Mirko_madeit_03_04"")"	SUBTITLE	袧芯 褝褌芯 锌褉邪胁写邪.	脥卯 媒艌卯 膹膽艜芒盲艜.
104344	-1	74957	DIA_EX_MIRKO_MADEIT_INFO	"AI_OUTPUT(SELF,OTHER,""DIA_EX_Mirko_madeit_03_05"")"	SUBTITLE	袨薪懈 蟹邪 屑薪芯泄 褋谢械写褟褌.	脦铆膷 莽艜 臎铆卯茅 艅毛暮盲藱艌.
104345	3197	247674	DIA_EX_MIRKO_MADEIT_INFO	INFO_ADDCHOICE.PAR1	INFO_ADDCHOICE.PAR1	袠写懈芯褌.	膶盲膷卯艌.
104346	3197	247675	DIA_EX_MIRKO_MADEIT_INFO	INFO_ADDCHOICE.PAR1	INFO_ADDCHOICE.PAR1	袣褌芯 芯薪懈?	臉艌卯 卯铆膷?
104347	-1	74958	DIA_EX_MIRKO_MADEIT_WHO	"AI_OUTPUT(OTHER,SELF,""DIA_EX_Mirko_madeit_who_15_00"")"	SUBTITLE	袣褌芯 芯薪懈?	臉艌卯 卯铆膷?
104348	-1	74958	DIA_EX_MIRKO_MADEIT_WHO	"AI_OUTPUT(SELF,OTHER,""DIA_EX_Mirko_madeit_who_03_01"")"	SUBTITLE	携 薪械 屑芯谐褍 褝褌芯谐芯 褋泻邪蟹邪褌褜.	Nie mog臋 tego powiedzie膰.
104349	-1	74958	DIA_EX_MIRKO_MADEIT_WHO	"AI_OUTPUT(SELF,OTHER,""DIA_EX_Mirko_madeit_who_03_02"")"	SUBTITLE	小谢懈褕泻芯屑 芯锌邪褋薪芯.	艃毛膷艡臋卯臎 卯膹艜艅铆卯.
104350	-1	74959	DIA_EX_MIRKO_MADEIT_IDIOT	"AI_OUTPUT(OTHER,SELF,""DIA_EX_Mirko_madeit_idiot_15_00"")"	SUBTITLE	袠写懈芯褌.	膶盲膷卯艌.
104351	3197	247680	DIA_EX_MIRKO_FRIGHTENED	C_INFO.DESCRIPTION	C_INFO.DESCRIPTION	袙褋械 械褖械 斜芯懈褕褜褋褟?	脗艅暮 暮暖暮 谩卯膷艡眉艅藱?
104352	-1	74962	DIA_EX_MIRKO_FRIGHTENED_INFO	"AI_OUTPUT(OTHER,SELF,""DIA_EX_Mirko_frightened_15_00"")"	SUBTITLE	袙褋械 械褖械 斜芯懈褕褜褋褟?	脗艅暮 暮暖暮 谩卯膷艡眉艅藱?
104353	-1	74962	DIA_EX_MIRKO_FRIGHTENED_INFO	"AI_OUTPUT(SELF,OTHER,""DIA_EX_Mirko_frightened_03_01"")"	SUBTITLE	效械谐芯 褌褘 褌邪泻 薪邪 屑械薪褟 褋屑芯褌褉懈褕褜?	Dlaczego tak na mnie patrzysz?
104354	-1	74962	DIA_EX_MIRKO_FRIGHTENED_INFO	"AI_OUTPUT(OTHER,SELF,""DIA_EX_Mirko_frightened_15_02"")"	SUBTITLE	啸芯褔械褕褜, 褟 褋褏芯卸褍 泻 胁褉邪褔褍?	艕卯梅暮艡眉, 藱 艅艖卯膰贸 臋 芒膽艜梅贸?
104355	-1	74962	DIA_EX_MIRKO_FRIGHTENED_INFO	"AI_OUTPUT(SELF,OTHER,""DIA_EX_Mirko_frightened_03_03"")"	SUBTITLE	袛褍屑邪械褕褜 褌褘 褋邪屑褘泄 褍屑薪褘泄? 袠写懈 芯褌褋褞写邪.	脛贸臎艜暮艡眉 艌疟 艅艜臎疟茅 贸臎铆疟茅? 膶盲膷 卯艌艅牛盲艜.
104356	3197	247685	DIA_EX_MIRKO_NEWS	C_INFO.DESCRIPTION	C_INFO.DESCRIPTION	袧褍, 芯薪懈 锌械褉械褋褌邪谢懈 蟹邪 褌芯斜芯泄 褋谢械写懈褌褜?	脥贸, 卯铆膷 膹暮膽暮艅艌艜毛膷 莽艜 艌卯谩卯茅 艅毛暮盲膷艌眉?
104357	-1	74965	DIA_EX_MIRKO_NEWS_INFO	"AI_OUTPUT(OTHER,SELF,""DIA_EX_Mirko_news_15_00"")"	SUBTITLE	袧褍, 芯薪懈 锌械褉械褋褌邪谢懈 蟹邪 褌芯斜芯泄 褋谢械写懈褌褜?	脥贸, 卯铆膷 膹暮膽暮艅艌艜毛膷 莽艜 艌卯谩卯茅 艅毛暮盲膷艌眉?
104358	-1	74965	DIA_EX_MIRKO_NEWS_INFO	"AI_OUTPUT(SELF,OTHER,""DIA_EX_Mirko_news_03_01"")"	SUBTITLE	袧械褌. 袝褋谢懈 屑薪械 锌芯胁械蟹械褌, 褌芯 芯薪懈 薪械 薪邪泄写褍褌 屑械薪褟.	Nie. 墓艅毛膷 臎铆暮 膹卯芒暮莽暮艌, 艌卯 卯铆膷 铆暮 铆艜茅盲贸艌 臎暮铆藱.
104359	-1	74965	DIA_EX_MIRKO_NEWS_INFO	"AI_OUTPUT(OTHER,SELF,""DIA_EX_Mirko_news_15_02"")"	SUBTITLE	孝械斜械 薪械 泻邪卸械褌褋褟, 褔褌芯 胁褋械 褝褌芯 锌邪褉邪薪芯泄褟?	艊暮谩暮 铆暮 臋艜膰暮艌艅藱, 梅艌卯 芒艅暮 媒艌卯 膹艜膽艜铆卯茅藱?
104360	-1	74965	DIA_EX_MIRKO_NEWS_INFO	"AI_OUTPUT(SELF,OTHER,""DIA_EX_Mirko_news_03_03"")"	SUBTITLE	袗 械褋谢懈 褌邪泻. 孝芯, 褔褌芯 褟 锌邪褉邪薪芯懈泻, 薪械 芯蟹薪邪褔邪械褌, 褔褌芯 芯薪懈 薪械 锌褉械褋谢械写褍褞褌 屑械薪褟.	艛 暮艅毛膷 艌艜臋. 艊卯, 梅艌卯 藱 膹艜膽艜铆卯膷臋, 铆暮 卯莽铆艜梅艜暮艌, 梅艌卯 卯铆膷 铆暮 膹膽暮艅毛暮盲贸牛艌 臎暮铆藱.
104361	3198	247690	DIA_EX_SENTA_WANTWEED	C_INFO.DESCRIPTION	C_INFO.DESCRIPTION	肖邪谢褜谐芯 锌褉懈褋谢邪谢 屑械薪褟. 携 锌褉懈褕械谢 蟹邪 斜芯谢芯褌薪懈泻芯屑.	脭艜毛眉膬卯 膹膽膷艅毛艜毛 臎暮铆藱. 脽 膹膽膷艡暮毛 莽艜 谩卯毛卯艌铆膷臋卯臎.
104362	-1	74971	DIA_EX_SENTA_WANTWEED_INFO	"AI_OUTPUT(OTHER,SELF,""DIA_EX_Senta_wantweed_15_00"")"	SUBTITLE	肖邪谢褜谐芯 锌褉懈褋谢邪谢 屑械薪褟. 携 锌褉懈褕械谢 蟹邪 斜芯谢芯褌薪懈泻芯屑.	脭艜毛眉膬卯 膹膽膷艅毛艜毛 臎暮铆藱. 脽 膹膽膷艡暮毛 莽艜 谩卯毛卯艌铆膷臋卯臎.
104363	-1	74971	DIA_EX_SENTA_WANTWEED_INFO	"AI_OUTPUT(SELF,OTHER,""DIA_EX_Senta_wantweed_10_01"")"	SUBTITLE	孝褘 械谐芯 薪芯胁褘泄 褍褔械薪懈泻?	艊疟 暮膬卯 铆卯芒疟茅 贸梅暮铆膷臋?
104364	-1	74971	DIA_EX_SENTA_WANTWEED_INFO	"AI_OUTPUT(SELF,OTHER,""DIA_EX_Senta_wantweed_10_02"")"	SUBTITLE	袥褞斜芯泄 屑芯卸械褌 褋泻邪蟹邪褌褜,褔褌芯 械谐芯 锌芯褋谢邪谢 肖邪谢褜谐芯 懈 蟹邪斜褉邪褌褜 胁褋褞 褌褉邪胁褍.	脣牛谩卯茅 臎卯膰暮艌 艅臋艜莽艜艌眉,梅艌卯 暮膬卯 膹卯艅毛艜毛 脭艜毛眉膬卯 膷 莽艜谩膽艜艌眉 芒艅牛 艌膽艜芒贸.
104365	-1	74971	DIA_EX_SENTA_WANTWEED_INFO	"AI_OUTPUT(OTHER,SELF,""DIA_EX_Senta_wantweed_15_03"")"	SUBTITLE	袧芯 屑械薪褟 懈 锌褉邪胁写邪 锌芯褋谢邪谢 肖邪谢褜谐芯.	脥卯 臎暮铆藱 膷 膹膽艜芒盲艜 膹卯艅毛艜毛 脭艜毛眉膬卯.
104366	-1	74971	DIA_EX_SENTA_WANTWEED_INFO	"AI_OUTPUT(SELF,OTHER,""DIA_EX_Senta_wantweed_10_04"")"	SUBTITLE	协褌芯 薪械 懈屑械械褌 蟹薪邪褔械薪懈械, 褍 屑械薪褟 胁褋械 褉邪胁薪芯 械械 薪械褌.	脻艌卯 铆暮 膷臎暮暮艌 莽铆艜梅暮铆膷暮, 贸 臎暮铆藱 芒艅暮 膽艜芒铆卯 暮暮 铆暮艌.
104367	-1	74971	DIA_EX_SENTA_WANTWEED_INFO	"AI_OUTPUT(OTHER,SELF,""DIA_EX_Senta_wantweed_15_05"")"	SUBTITLE	袩芯褔械屑褍?	Dlaczego?
104368	-1	74971	DIA_EX_SENTA_WANTWEED_INFO	"AI_OUTPUT(SELF,OTHER,""DIA_EX_Senta_wantweed_10_06"")"	SUBTITLE	袧械褌褍褋 薪械 锌褉懈褕械谢.	脥暮艌贸艅 铆暮 膹膽膷艡暮毛.
104369	3198	247698	DIA_EX_SENTA_WANTWEED_INFO	B_LOGENTRY.ENTRY	LOG_ADDENTRY.PAR1	小械薪褌邪 锌褉芯懈谐薪芯褉懈褉芯胁邪谢 褌芯褌 褎邪泻褌, 褔褌芯 褟 薪芯胁褘泄 褍褔械薪懈泻 肖邪谢褜谐芯, 泻 褌芯屑褍 卸械 褍 薪械谐芯 薪械褌 褌褉邪胁褘, 锌芯褌芯屑褍 褔褌芯 薪械泻懈泄 (袧械褌褍褋 薪械 锌褉懈褕械谢).	艃暮铆艌艜 膹膽卯膷膬铆卯膽膷膽卯芒艜毛 艌卯艌 么艜臋艌, 梅艌卯 藱 铆卯芒疟茅 贸梅暮铆膷臋 脭艜毛眉膬卯, 臋 艌卯臎贸 膰暮 贸 铆暮膬卯 铆暮艌 艌膽艜芒疟, 膹卯艌卯臎贸 梅艌卯 铆暮臋膷茅 (脥暮艌贸艅 铆暮 膹膽膷艡暮毛).
104370	3198	247699	DIA_EX_SENTA_WHOIS	C_INFO.DESCRIPTION	C_INFO.DESCRIPTION	袣褌芯 褌邪泻芯泄 袧械褌褍褋?	臉艌卯 艌艜臋卯茅 脥暮艌贸艅?
104371	-1	74974	DIA_EX_SENTA_WHOIS_INFO	"AI_OUTPUT(OTHER,SELF,""DIA_EX_Senta_whois_15_00"")"	SUBTITLE	袣褌芯 褌邪泻芯泄 袧械褌褍褋?	臉艌卯 艌艜臋卯茅 脥暮艌贸艅?
104372	-1	74974	DIA_EX_SENTA_WHOIS_INFO	"AI_OUTPUT(SELF,OTHER,""DIA_EX_Senta_whois_10_01"")"	SUBTITLE	袨薪 褋芯斜懈褉邪械褌 写谢褟 薪邪褋 斜芯谢芯褌薪懈泻 胁 谢械褋褍.	脦铆 艅卯谩膷膽艜暮艌 盲毛藱 铆艜艅 谩卯毛卯艌铆膷臋 芒 毛暮艅贸.
104373	-1	74974	DIA_EX_SENTA_WHOIS_INFO	"AI_OUTPUT(OTHER,SELF,""DIA_EX_Senta_whois_15_02"")"	SUBTITLE	袙 谢械褋褍?	脗 毛暮艅贸?
104374	-1	74974	DIA_EX_SENTA_WHOIS_INFO	"AI_OUTPUT(OTHER,SELF,""DIA_EX_Senta_whois_15_03"")"	SUBTITLE	携 写褍屑邪谢, 褔褌芯 械谐芯 薪褍卸薪芯 褋芯斜懈褉邪褌褜 薪邪 斜芯谢芯褌械.	脽 盲贸臎艜毛, 梅艌卯 暮膬卯 铆贸膰铆卯 艅卯谩膷膽艜艌眉 铆艜 谩卯毛卯艌暮.
104375	-1	74974	DIA_EX_SENTA_WHOIS_INFO	"AI_OUTPUT(SELF,OTHER,""DIA_EX_Senta_whois_10_04"")"	SUBTITLE	袣芯薪械褔薪芯, 薪芯 胁 谢械褋褍 械褋褌褜 锌芯写褏芯写褟褖械械 屑械褋褌芯 胁芯蟹谢械 写械褉械胁邪 褋 屑械写芯屑.	臉卯铆暮梅铆卯, 铆卯 芒 毛暮艅贸 暮艅艌眉 膹卯盲艖卯盲藱暖暮暮 臎暮艅艌卯 芒卯莽毛暮 盲暮膽暮芒艜 艅 臎暮盲卯臎.
104376	-1	74974	DIA_EX_SENTA_WHOIS_INFO	"AI_OUTPUT(SELF,OTHER,""DIA_EX_Senta_whois_10_05"")"	SUBTITLE	袙芯褌 褌邪屑 芯薪 懈 胁褘褉邪褖懈胁邪械褌 斜芯谢芯褌薪懈泻.	脗卯艌 艌艜臎 卯铆 膷 芒疟膽艜暖膷芒艜暮艌 谩卯毛卯艌铆膷臋.
104377	-1	74974	DIA_EX_SENTA_WHOIS_INFO	"AI_OUTPUT(SELF,OTHER,""DIA_EX_Senta_whois_10_06"")"	SUBTITLE	袧芯 芯薪 褍卸械 写芯谢卸械薪 斜褘谢 胁械褉薪褍褌褜褋褟 褍卸械 薪械褋泻芯谢褜泻芯 写薪械泄 薪邪蟹邪写.	脥卯 卯铆 贸膰暮 盲卯毛膰暮铆 谩疟毛 芒暮膽铆贸艌眉艅藱 贸膰暮 铆暮艅臋卯毛眉臋卯 盲铆暮茅 铆艜莽艜盲.
104378	3198	247707	DIA_EX_SENTA_DONTYOUWORRY	C_INFO.DESCRIPTION	C_INFO.DESCRIPTION	孝械斜褟 褝褌芯 薪械 斜械褋锌芯泻芯懈褌?	艊暮谩藱 媒艌卯 铆暮 谩暮艅膹卯臋卯膷艌?
104379	-1	74977	DIA_EX_SENTA_DONTYOUWORRY_INFO	"AI_OUTPUT(OTHER,SELF,""DIA_EX_Senta_dontyouworry_15_00"")"	SUBTITLE	孝械斜褟 褝褌芯 薪械 斜械褋锌芯泻芯懈褌?	艊暮谩藱 媒艌卯 铆暮 谩暮艅膹卯臋卯膷艌?
104380	-1	74977	DIA_EX_SENTA_DONTYOUWORRY_INFO	"AI_OUTPUT(SELF,OTHER,""DIA_EX_Senta_dontyouworry_10_01"")"	SUBTITLE	袗 写芯谢卸薪芯? 袨薪 褔邪褋褌芯 褍褏芯写懈谢 褌邪泻 薪邪写芯谢谐芯.	艛 盲卯毛膰铆卯? 脦铆 梅艜艅艌卯 贸艖卯盲膷毛 艌艜臋 铆艜盲卯毛膬卯.
104381	-1	74977	DIA_EX_SENTA_DONTYOUWORRY_INFO	"AI_OUTPUT(SELF,OTHER,""DIA_EX_Senta_dontyouworry_10_02"")"	SUBTITLE	袗 胁 锌芯褋械谢芯泻 锌褉懈褏芯写懈褌, 褌芯谢褜泻芯 褔褌芯斜褘 写芯褋褌邪胁懈褌褜 褌褉邪胁褍.	艛 芒 膹卯艅暮毛卯臋 膹膽膷艖卯盲膷艌, 艌卯毛眉臋卯 梅艌卯谩疟 盲卯艅艌艜芒膷艌眉 艌膽艜芒贸.
104382	3198	247711	DIA_EX_SENTA_ISEARCHHIM	C_INFO.DESCRIPTION	C_INFO.DESCRIPTION	携 锌芯锌褉芯斜褍褞 薪邪泄褌懈 械谐芯.	脽 膹卯膹膽卯谩贸牛 铆艜茅艌膷 暮膬卯.
104383	-1	74980	DIA_EX_SENTA_ISEARCHHIM_INFO	"AI_OUTPUT(OTHER,SELF,""DIA_EX_Senta_Isearchhim_15_00"")"	SUBTITLE	携 锌芯锌褉芯斜褍褞 薪邪泄褌懈 械谐芯.	脽 膹卯膹膽卯谩贸牛 铆艜茅艌膷 暮膬卯.
104384	-1	74980	DIA_EX_SENTA_ISEARCHHIM_INFO	"AI_OUTPUT(SELF,OTHER,""DIA_EX_Senta_Isearchhim_10_01"")"	SUBTITLE	袛械谢邪泄 泻邪泻 蟹薪邪械褕褜.	脛暮毛艜茅 臋艜臋 莽铆艜暮艡眉.
104385	-1	74980	DIA_EX_SENTA_ISEARCHHIM_INFO	"AI_OUTPUT(SELF,OTHER,""DIA_EX_Senta_Isearchhim_10_02"")"	SUBTITLE	袠 锌械褉械写邪胁邪泄 械屑褍 锌芯褌芯屑, 褔褌芯 械褋谢懈 芯薪 褋泻芯褉芯 薪械 锌褉懈写械褌.	膶 膹暮膽暮盲艜芒艜茅 暮臎贸 膹卯艌卯臎, 梅艌卯 暮艅毛膷 卯铆 艅臋卯膽卯 铆暮 膹膽膷盲暮艌.
104386	-1	74980	DIA_EX_SENTA_ISEARCHHIM_INFO	"AI_OUTPUT(SELF,OTHER,""DIA_EX_Senta_Isearchhim_10_03"")"	SUBTITLE	孝芯 褟 斜褍写褍 懈褋泻邪褌褜 褋械斜械 写褉褍谐芯谐芯 锌芯褋褌邪胁褖懈泻邪.	艊卯 藱 谩贸盲贸 膷艅臋艜艌眉 艅暮谩暮 盲膽贸膬卯膬卯 膹卯艅艌艜芒暖膷臋艜.
104387	3198	247716	DIA_EX_SENTA_ISEARCHHIM_INFO	B_LOGENTRY.ENTRY	LOG_ADDENTRY.PAR1	携 锌褉械写谢芯卸懈谢 小械薪褌械 薪邪泄褌懈 械谐芯 锌芯褋褌邪胁褖懈泻邪, 褔褌芯斜褘 薪邪泻芯薪械褑-褌芯 锌芯谢褍褔懈褌褜 斜芯谢芯褌薪褍褞 褌褉邪胁褍.	脽 膹膽暮盲毛卯膰膷毛 艃暮铆艌暮 铆艜茅艌膷 暮膬卯 膹卯艅艌艜芒暖膷臋艜, 梅艌卯谩疟 铆艜臋卯铆暮枚-艌卯 膹卯毛贸梅膷艌眉 谩卯毛卯艌铆贸牛 艌膽艜芒贸.
104388	3198	247717	DIA_EX_SENTA_ISEARCHHIM_INFO	B_STARTMISSION.FIRSTNOTE	LOG_ADDENTRY.PAR1	袧械褌褍褋, 锌芯褋褌邪胁褖懈泻 斜芯谢芯褌薪褘褏 褌褉邪胁 小械薪褌褘, 懈褋褔械蟹 斜械蟹 褋谢械写邪. 携 褋芯谐谢邪褋懈谢褋褟 懈褋泻邪褌褜 械谐芯. 袚芯胁芯褉褟褌, 褔褌芯 芯薪 褔邪褋褌芯 斜褘胁邪械褌 谢械褋褍 胁芯蟹谢械 写械褉械胁邪 褋 屑械写芯屑.	脥暮艌贸艅, 膹卯艅艌艜芒暖膷臋 谩卯毛卯艌铆疟艖 艌膽艜芒 艃暮铆艌疟, 膷艅梅暮莽 谩暮莽 艅毛暮盲艜. 脽 艅卯膬毛艜艅膷毛艅藱 膷艅臋艜艌眉 暮膬卯. 膫卯芒卯膽藱艌, 梅艌卯 卯铆 梅艜艅艌卯 谩疟芒艜暮艌 毛暮艅贸 芒卯莽毛暮 盲暮膽暮芒艜 艅 臎暮盲卯臎.
104389	3198	247719	DIA_EX_SENTA_FOUNDHIM	C_INFO.DESCRIPTION	C_INFO.DESCRIPTION	携 薪邪褕械谢 袧械褌褍褋邪.	脽 铆艜艡暮毛 脥暮艌贸艅艜.
104390	-1	74983	DIA_EX_SENTA_FOUNDHIM_INFO	"AI_OUTPUT(OTHER,SELF,""DIA_EX_Senta_foundhim_15_00"")"	SUBTITLE	携 薪邪褕械谢 袧械褌褍褋邪.	脽 铆艜艡暮毛 脥暮艌贸艅艜.
104391	-1	74983	DIA_EX_SENTA_FOUNDHIM_INFO	"AI_OUTPUT(SELF,OTHER,""DIA_EX_Senta_foundhim_10_01"")"	SUBTITLE	袠? 袚写械 芯薪?	I? Gdzie on jest?
104392	-1	74983	DIA_EX_SENTA_FOUNDHIM_INFO	"AI_OUTPUT(OTHER,SELF,""DIA_EX_Senta_foundhim_15_02"")"	SUBTITLE	袨薪 屑械褉褌胁. 袣褉芯胁邪胁褘械 屑褍褏懈 褋写械谢邪谢懈 褋胁芯械 写械谢芯.	On nie 偶yje. 臉膽卯芒艜芒疟暮 臎贸艖膷 艅盲暮毛艜毛膷 艅芒卯暮 盲暮毛卯.
104393	-1	74983	DIA_EX_SENTA_FOUNDHIM_INFO	"AI_OUTPUT(SELF,OTHER,""DIA_EX_Senta_foundhim_10_03"")"	SUBTITLE	袙芯褌 懈写懈芯褌. 袣褌芯 褌械锌械褉褜 斜褍写械褌 褋芯斜懈褉邪褌褜 写谢褟 屑械薪褟 褌褉邪胁褘?	脗卯艌 膷盲膷卯艌. 臉艌卯 艌暮膹暮膽眉 谩贸盲暮艌 艅卯谩膷膽艜艌眉 盲毛藱 臎暮铆藱 艌膽艜芒疟?
104394	-1	74983	DIA_EX_SENTA_FOUNDHIM_INFO	"AI_OUTPUT(SELF,OTHER,""DIA_EX_Senta_foundhim_10_04"")"	SUBTITLE	袛褍屑邪褞 褋褌芯懈褌 芯褌锌褉邪胁懈褌褜 袡械薪邪.	脛贸臎艜牛 艅艌卯膷艌 卯艌膹膽艜芒膷艌眉 脡暮铆艜.
104395	-1	74983	DIA_EX_SENTA_FOUNDHIM_INFO	"AI_OUTPUT(SELF,OTHER,""DIA_EX_Senta_foundhim_10_05"")"	SUBTITLE	袝褋谢懈 泻芯薪械褔薪芯, 蟹胁械褉懈 械谐芯 褌芯卸械 薪械 褍斜褜褞褌...	墓艅毛膷 臋卯铆暮梅铆卯, 莽芒暮膽膷 暮膬卯 艌卯膰暮 铆暮 贸谩眉牛艌...
104396	-1	74983	DIA_EX_SENTA_FOUNDHIM_INFO	"AI_OUTPUT(SELF,OTHER,""DIA_EX_Senta_foundhim_10_06"")"	SUBTITLE	小泻邪卸懈 屑薪械, 褍 袧械褌褍褋邪 斜褘谢邪 褋 褋芯斜芯泄 褌褉邪胁邪?	艃臋艜膰膷 臎铆暮, 贸 脥暮艌贸艅艜 谩疟毛艜 艅 艅卯谩卯茅 艌膽艜芒艜?
104397	3198	247727	DIA_EX_SENTA_FOUNDHIM_INFO	B_SUCCESSMISSION.LASTNODE	LOG_ADDENTRY.PAR1	袧械褌褍褋邪 褋屑械薪懈褌 袡械薪, 芯斜褉邪斜芯褌褔懈泻 斜芯谢芯褌薪褘褏 褌褉邪胁 小械薪褌褘.	脥暮艌贸艅艜 艅臎暮铆膷艌 脡暮铆, 卯谩膽艜谩卯艌梅膷臋 谩卯毛卯艌铆疟艖 艌膽艜芒 艃暮铆艌疟.
104398	3198	247731	DIA_EX_SENTA_FOUNDWEED	C_INFO.DESCRIPTION	C_INFO.DESCRIPTION	袛邪, 胁芯褌 芯薪邪.	Tak, oto ona.
104399	-1	74986	DIA_EX_SENTA_FOUNDWEED_INFO	"AI_OUTPUT(OTHER,SELF,""DIA_EX_Senta_foundweed_15_00"")"	SUBTITLE	袛邪, 胁芯褌 芯薪邪.	Tak, oto ona.
104400	-1	74986	DIA_EX_SENTA_FOUNDWEED_INFO	"AI_OUTPUT(SELF,OTHER,""DIA_EX_Senta_foundweed_10_01"")"	SUBTITLE	袨褌谢懈褔薪芯!	Doskonale!
104401	-1	74986	DIA_EX_SENTA_FOUNDWEED_INFO	"AI_OUTPUT(SELF,OTHER,""DIA_EX_Senta_foundweed_10_02"")"	SUBTITLE	袙芯褌, 写械褉卸懈 写械薪褜谐懈, 泻芯褌芯褉褘械 褟 写芯谢卸械薪 斜褘谢 蟹邪锌谢邪褌懈褌褜 械屑褍.	脗卯艌, 盲暮膽膰膷 盲暮铆眉膬膷, 臋卯艌卯膽疟暮 藱 盲卯毛膰暮铆 谩疟毛 莽艜膹毛艜艌膷艌眉 暮臎贸.
104402	-1	74986	DIA_EX_SENTA_FOUNDWEED_INFO	"AI_OUTPUT(OTHER,SELF,""DIA_EX_Senta_whengetweed_15_00"")"	SUBTITLE	袣芯谐写邪 褟 褋屑芯谐褍 蟹邪斜褉邪褌褜 谐芯褌芯胁褘泄 褌芯胁邪褉? 肖邪谢褜谐芯 褍卸械 蟹邪卸写邪谢褋褟.	臉卯膬盲艜 藱 艅臎卯膬贸 莽艜谩膽艜艌眉 膬卯艌卯芒疟茅 艌卯芒艜膽? 脭艜毛眉膬卯 贸膰暮 莽艜膰盲艜毛艅藱.
104403	-1	74986	DIA_EX_SENTA_FOUNDWEED_INFO	"AI_OUTPUT(SELF,OTHER,""DIA_EX_Senta_whengetweed_10_01"")"	SUBTITLE	袩褉懈褏芯写懈 褔械褉械蟹 褌褉懈 褔邪褋邪.	膸膽膷艖卯盲膷 梅暮膽暮莽 艌膽膷 梅艜艅艜.
104404	-1	74989	DIA_EX_SENTA_TAKEWEED_INFO	"AI_OUTPUT(SELF,OTHER,""DIA_EX_Senta_takeweed_10_00"")"	SUBTITLE	袙芯褌, 写械褉卸懈.	Prosz臋 bardzo!
104405	-1	74989	DIA_EX_SENTA_TAKEWEED_INFO	"AI_OUTPUT(SELF,OTHER,""DIA_EX_Senta_takeweed_10_01"")"	SUBTITLE	肖邪谢褜谐芯 褍卸械 蟹邪锌谢邪褌懈谢.	脭艜毛眉膬卯 贸膰暮 莽艜膹毛艜艌膷毛.
104406	-1	74989	DIA_EX_SENTA_TAKEWEED_INFO	"AI_OUTPUT(SELF,OTHER,""DIA_EX_Senta_takeweed_10_02"")"	SUBTITLE	袟写械褋褜 薪械屑薪芯谐芯 斜芯谢褜褕械 蟹邪 写谢懈褌械谢褜薪芯械 芯卸懈写邪薪懈械.	脟盲暮艅眉 铆暮臎铆卯膬卯 谩卯毛眉艡暮 莽艜 盲毛膷艌暮毛眉铆卯暮 卯膰膷盲艜铆膷暮.
