NR	FILENR	ID	SYMBOL	USE	TRACE	RU	PL
99056	-1	72450	DIA_THORBEN_TEACH_WOOD_INFO	"AI_OUTPUT(SELF,OTHER,""DIA_Thorben_TeachWood_06_02"")"	SUBTITLE	袙褘褉械卸褜 懈蟹 斜褉械胁薪邪 褉芯胁薪褘泄 褋褌胁芯谢 懈 锌懈谢懈 械谐芯 锌褉芯写芯谢褜薪芯, 胁褋械 胁褉械屑褟 褍屑械薪褜褕邪褟 褕懈褉懈薪褍 写芯 屑械谢泻懈褏 蟹邪谐芯褌芯胁芯泻.	Z k艂ody wycinamy r贸wny pie艅 i przecinamy go wzd艂u偶, ca艂y czas zmniejszaj膮c szeroko艣膰 do ma艂ych kawa艂k贸w.
99057	-1	72450	DIA_THORBEN_TEACH_WOOD_INFO	"AI_OUTPUT(SELF,OTHER,""DIA_Thorben_TeachWood_06_03"")"	SUBTITLE	袟邪褌械屑 薪邪 褋褌芯谢褟褉薪芯屑 胁械褉褋褌邪泻械 褉邪褋泻芯谢懈 锌芯谢械薪芯 薪邪 褔械褌褘褉械 褉芯胁薪褘械 褔邪褋褌懈.	脟艜艌暮臎 铆艜 艅艌卯毛藱膽铆卯臎 芒暮膽艅艌艜臋暮 膽艜艅臋卯毛膷 膹卯毛暮铆卯 铆艜 梅暮艌疟膽暮 膽卯芒铆疟暮 梅艜艅艌膷.
99058	-1	72450	DIA_THORBEN_TEACH_WOOD_INFO	"AI_OUTPUT(SELF,OTHER,""DIA_Thorben_TeachWood_06_04"")"	SUBTITLE	袠 褌褖邪褌械谢褜薪芯 芯斜褉邪斜芯褌邪泄 懈褏 褉褍斜邪薪泻芯屑, 锌褉懈写邪胁 薪褍卸薪褍褞 褎芯褉屑褍 懈 锌褉懈 薪械芯斜褏芯写懈屑芯褋褌懈 写芯锌芯谢薪懈褌械谢褜薪芯 写芯褉邪斜芯褌邪泄 锌芯胁械褉褏薪芯褋褌褜 芯褋褌褉褘屑 泻懈薪卸邪谢芯屑.	膶 艌暖艜艌暮毛眉铆卯 卯谩膽艜谩卯艌艜茅 膷艖 膽贸谩艜铆臋卯臎, 膹膽膷盲艜芒 铆贸膰铆贸牛 么卯膽臎贸 膷 膹膽膷 铆暮卯谩艖卯盲膷臎卯艅艌膷 盲卯膹卯毛铆膷艌暮毛眉铆卯 盲卯膽艜谩卯艌艜茅 膹卯芒暮膽艖铆卯艅艌眉 卯艅艌膽疟臎 臋膷铆膰艜毛卯臎.
99059	-1	72450	DIA_THORBEN_TEACH_WOOD_INFO	"AI_OUTPUT(SELF,OTHER,""DIA_Thorben_TeachWood_06_05"")"	SUBTITLE	孝邪泻懈屑 芯斜褉邪蟹芯屑 褌褘 屑芯卸械褕褜 胁褘褋褌褉芯谐邪褌褜 谢褞斜褍褞 蟹邪谐芯褌芯胁泻褍. 啸芯褌褟 褟 褋芯屑薪械胁邪褞褋褜, 褔褌芯 褌褘 褋芯斜懈褉邪械褕褜褋褟 懈蟹谐芯褌邪胁谢懈胁邪褌褜 屑械斜械谢褜.	艊艜臋膷臎 卯谩膽艜莽卯臎 艌疟 臎卯膰暮艡眉 芒疟艅艌膽卯膬艜艌眉 毛牛谩贸牛 莽艜膬卯艌卯芒臋贸. 艕卯艌藱 藱 艅卯臎铆暮芒艜牛艅眉, 梅艌卯 艌疟 艅卯谩膷膽艜暮艡眉艅藱 膷莽膬卯艌艜芒毛膷芒艜艌眉 臎暮谩暮毛眉.
99060	-1	72450	DIA_THORBEN_TEACH_WOOD_INFO	"AI_OUTPUT(SELF,OTHER,""DIA_Thorben_TeachWood_06_06"")"	SUBTITLE	孝邪泻 褔褌芯 薪邪胁械褉薪芯 褋褌芯懈褌 褌械斜褟 薪邪褍褔懈褌褜 械褖械 懈 胁褘褉械蟹邪褌褜 褋褌褉械谢褘 懈 斜芯谢褌褘.	艊艜臋 梅艌卯 铆艜芒暮膽铆卯 艅艌卯膷艌 艌暮谩藱 铆艜贸梅膷艌眉 暮暖暮 膷 芒疟膽暮莽艜艌眉 艅艌膽暮毛疟 膷 谩卯毛艌疟.
99061	-1	72450	DIA_THORBEN_TEACH_WOOD_INFO	"AI_OUTPUT(SELF,OTHER,""DIA_Thorben_TeachWood_06_07"")"	SUBTITLE	小薪邪褔邪谢邪 褌械斜械 泻芯薪械褔薪芯 锌褉懈写械褌褋褟 胁褘泻芯胁邪褌褜 写谢褟 薪懈褏 薪邪泻芯薪械褔薪懈泻懈.	艃铆艜梅艜毛艜 艌暮谩暮 臋卯铆暮梅铆卯 膹膽膷盲暮艌艅藱 芒疟臋卯芒艜艌眉 盲毛藱 铆膷艖 铆艜臋卯铆暮梅铆膷臋膷.
99062	-1	72450	DIA_THORBEN_TEACH_WOOD_INFO	"AI_OUTPUT(SELF,OTHER,""DIA_Thorben_TeachWood_06_08"")"	SUBTITLE	孝褘 薪邪褍褔懈谢褋褟 胁褘褉械蟹邪褌褜 写褉械胁泻懈. 袧芯 褉邪斜芯褌邪 薪邪 褋褌芯谢褟褉薪芯屑 胁械褉褋褌邪泻械 褝褌芯 芯褌写械谢褜薪褘泄 薪邪胁褘泻.	艊疟 铆艜贸梅膷毛艅藱 芒疟膽暮莽艜艌眉 盲膽暮芒臋膷. 脥卯 膽艜谩卯艌艜 铆艜 艅艌卯毛藱膽铆卯臎 芒暮膽艅艌艜臋暮 媒艌卯 卯艌盲暮毛眉铆疟茅 铆艜芒疟臋.
99063	-1	72450	DIA_THORBEN_TEACH_WOOD_INFO	"AI_OUTPUT(SELF,OTHER,""DIA_Thorben_TeachWood_06_09"")"	SUBTITLE	袛邪谢械械 薪邪 胁械褉褋褌邪泻械 锌褉芯褋褌芯 褉邪褋泻邪谢褘胁邪械褕褜 锌芯谢械薪芯 懈谢懈 斜褉褍褋 薪邪 薪械褋泻芯谢褜泻芯 褔邪褋褌械泄, 胁褘褉械蟹邪械褕褜 泻懈薪卸邪谢芯屑 写褉械胁泻芯 薪褍卸薪芯泄 写谢懈薪薪褘 懈 泻褉械锌懈褕褜 泻 薪械屑褍 薪邪泻芯薪械褔薪懈泻.	脛艜毛暮暮 铆艜 芒暮膽艅艌艜臋暮 膹膽卯艅艌卯 膽艜艅臋艜毛疟芒艜暮艡眉 膹卯毛暮铆卯 膷毛膷 谩膽贸艅 铆艜 铆暮艅臋卯毛眉臋卯 梅艜艅艌暮茅, 芒疟膽暮莽艜暮艡眉 臋膷铆膰艜毛卯臎 盲膽暮芒臋卯 铆贸膰铆卯茅 盲毛膷铆铆疟 膷 臋膽暮膹膷艡眉 臋 铆暮臎贸 铆艜臋卯铆暮梅铆膷臋.
99064	-1	72450	DIA_THORBEN_TEACH_WOOD_INFO	"AI_OUTPUT(SELF,OTHER,""DIA_Thorben_TeachWood_06_10"")"	SUBTITLE	袠 泻邪泻 褟 褍卸械 褌械斜械 谐芯胁芯褉懈谢 写谢褟 胁褘褉械蟹邪薪懈褟 褋褌褉械谢 懈 斜芯谢褌芯胁 锌芯写芯泄写褍褌 芯斜褘褔薪褘械 褌褟卸械谢褘械 锌邪谢泻懈 懈 褎邪泻械谢褘.	膶 臋艜臋 藱 贸膰暮 艌暮谩暮 膬卯芒卯膽膷毛 盲毛藱 芒疟膽暮莽艜铆膷藱 艅艌膽暮毛 膷 谩卯毛艌卯芒 膹卯盲卯茅盲贸艌 卯谩疟梅铆疟暮 艌藱膰暮毛疟暮 膹艜毛臋膷 膷 么艜臋暮毛疟.
99065	-1	72450	DIA_THORBEN_TEACH_WOOD_INFO	"AI_OUTPUT(SELF,OTHER,""DIA_Thorben_TeachWood_06_11"")"	SUBTITLE	袧芯 泻芯薪械褔薪芯 懈蟹 薪懈褏 褌褘 锌芯谢褍褔懈褕褜 谐芯褉邪蟹写芯 屑械薪褜褕械 褋褌褉械谢 懈 斜芯谢褌芯胁, 褔械屑 懈蟹 褏芯褉芯褕械谐芯 斜褉褍褋邪.	脥卯 臋卯铆暮梅铆卯 膷莽 铆膷艖 艌疟 膹卯毛贸梅膷艡眉 膬卯膽艜莽盲卯 臎暮铆眉艡暮 艅艌膽暮毛 膷 谩卯毛艌卯芒, 梅暮臎 膷莽 艖卯膽卯艡暮膬卯 谩膽贸艅艜.
99066	3144	242021	DIA_THORBEN_TEACH_WOOD_INFO	B_LOGENTRY.ENTRY	LOG_ADDENTRY.PAR1	袛谢褟 芯斜褉邪斜芯褌泻懈 写褉械胁械褋懈薪褘 薪褍卸械薪 褋褌芯谢褟褉薪褘泄 胁械褉褋褌邪泻, 懈薪褋褌褉褍屑械薪褌褘 薪邪 薪械屑 懈 泻懈薪卸邪谢.	脛毛藱 卯谩膽艜谩卯艌臋膷 盲膽暮芒暮艅膷铆疟 铆贸膰暮铆 艅艌卯毛藱膽铆疟茅 芒暮膽艅艌艜臋, 膷铆艅艌膽贸臎暮铆艌疟 铆艜 铆暮臎 膷 臋膷铆膰艜毛.
99067	3144	242022	DIA_THORBEN_TEACH_WOOD_INFO	B_LOGENTRY_QUIET.ENTRY	LOG_ADDENTRY.PAR1	袦芯卸薪芯 锌芯谢褍褔懈褌褜 写褉械胁泻懈, 蟹邪谐芯褌芯胁泻懈 锌芯褋芯褏芯胁, 蟹邪谐芯褌芯胁泻懈 褋褌褉械谢 懈 斜芯谢褌芯胁.	臍卯膰铆卯 膹卯毛贸梅膷艌眉 盲膽暮芒臋膷, 莽艜膬卯艌卯芒臋膷 膹卯艅卯艖卯芒, 莽艜膬卯艌卯芒臋膷 艅艌膽暮毛 膷 谩卯毛艌卯芒.
99068	-1	72450	DIA_THORBEN_TEACH_WOOD_INFO	"AI_OUTPUT(SELF,OTHER,""DIA_Thorben_TRADE_09_05"")"	SUBTITLE	袩褉懈褏芯写懈 写薪械屑.	Przyjd藕 po po艂udniu.
99317	-1	72530	DIA_THORBEN_TEACHWEAPONWOOD_INFO	"AI_OUTPUT(SELF,OTHER,""DIA_Niclas_TeachWood_06_03"")"	SUBTITLE	袩芯褌芯屑 斜褉褍褋 懈谢懈 锌芯谢械薪芯 锌械褉械薪械褋懈 薪邪 褋褌芯谢褟褉薪褘泄 胁褍械褉褋褌邪泻.	膸卯艌卯臎 谩膽贸艅 膷毛膷 膹卯毛暮铆卯 膹暮膽暮铆暮艅膷 铆艜 艅艌卯毛藱膽铆疟茅 芒贸暮膽艅艌艜臋.
99318	-1	72530	DIA_THORBEN_TEACHWEAPONWOOD_INFO	"AI_OUTPUT(SELF,OTHER,""DIA_Niclas_TeachWood_06_04"")"	SUBTITLE	袨斜褌邪褔懈胁邪械泄 写芯 褌械褏 锌芯褉, 锌芯泻邪 薪械 锌芯谢褍褔懈褌褋褟 写褉械胁泻芯 薪褍卸薪芯谐芯 褌械斜械 褉邪蟹屑械褉邪. 袛谢褟 斜芯谢褌芯胁 褉邪褋锌懈谢懈 写褉械胁泻芯 锌芯锌芯谢邪屑.	Przecinaj go, a偶 uzyskasz trzon o wymaganym rozmiarze. W przypadku be艂t贸w, przetnij trzon na p贸艂.
99338	-1	72536	DIA_THORBEN_ABOUTPOCKERMANUFACTURING_INFO	"AI_OUTPUT(SELF,OTHER,""DIA_Thorben_AboutPockerManufacturing_06_03"")"	SUBTITLE	袙懈卸褍, 褌械斜褟 薪械 锌械褉械褍斜械写懈褌褜. 效褌芯 卸械, 褟 褋写械谢邪褞 褝褌芯褌 薪邪斜芯褉 蟹邪 褋褌芯 屑芯薪械褌.	脗膷膰贸, 艌暮谩藱 铆暮 膹暮膽暮贸谩暮盲膷艌眉. 脳艌卯 膰暮, 藱 艅盲暮毛艜牛 媒艌卯艌 铆艜谩卯膽 莽艜 艅艌卯 臎卯铆暮艌.
99342	3144	242315	DIA_THORBEN_ABOUTPOCKERMANUFACTURING_INFO	B_LOGENTRY.ENTRY	LOG_ADDENTRY.PAR1	袩谢芯褌薪懈泻 孝芯褉斜械薪 锌褉芯写邪械褌 薪邪斜芯褉褘 写谢褟 锌芯泻械褉邪, 褔械褉械蟹 3 写薪褟 锌芯褋谢械 褌芯谐芯, 泻邪泻 胁褘泻褍锌褟褌 锌褉械写褘写褍褖懈泄.	膸毛卯艌铆膷臋 艊卯膽谩暮铆 膹膽卯盲艜暮艌 铆艜谩卯膽疟 盲毛藱 膹卯臋暮膽艜, 梅暮膽暮莽 3 盲铆藱 膹卯艅毛暮 艌卯膬卯, 臋艜臋 芒疟臋贸膹藱艌 膹膽暮盲疟盲贸暖膷茅.
99481	-1	72597	DIA_CANTHAR_ABOUT_AVTORADVJACK_INFO	"AI_OUTPUT(SELF,OTHER,""DIA_Canthar_About_AvtorAdvJack_09_01"")"	SUBTITLE	袦薪械 斜芯谢褜褕械 写械谢邪褌褜 薪械褔械谐芯, 褔械屑 褔懈褌邪褌褜 褝褌褍 褏褉械薪褜.	臍铆暮 谩卯毛眉艡暮 盲暮毛艜艌眉 铆暮梅暮膬卯, 梅暮臎 梅膷艌艜艌眉 媒艌贸 艖膽暮铆眉.
99483	-1	72597	DIA_CANTHAR_ABOUT_AVTORADVJACK_INFO	"AI_OUTPUT(SELF,OTHER,""DIA_Canthar_About_AvtorAdvJack_09_02"")"	SUBTITLE	袠褏 写邪械褌 薪邪 褉械邪谢懈蟹邪褑褞 袥褞褌械褉芯 懈蟹 胁械褉褏薪械谐芯 泻胁邪褉褌邪谢邪.	Lutero z g贸rnego miasta daje mi je na sprzeda偶.
100525	-1	73070	DIA_RENGARU_ELITELOCKPICKOK_INFO	"AI_OUTPUT(SELF,OTHER,""DIA_Rengaru_EliteLockpickOK_07_07"")"	SUBTITLE	校 屑械薪褟 械褋褌褜 屑械写芯胁褘泄 褌邪斜邪泻, 谢懈斜芯 屑芯谐褍 芯褌写邪褌褜 褔邪褋褌褜 蟹芯谢芯褌邪 蟹邪 褌芯胁邪褉. 效褌芯 胁褘斜懈褉邪械褕褜?	脫 臎暮铆藱 暮艅艌眉 臎暮盲卯芒疟茅 艌艜谩艜臋, 毛膷谩卯 臎卯膬贸 卯艌盲艜艌眉 梅艜艅艌眉 莽卯毛卯艌艜 莽艜 艌卯芒艜膽. 脳艌卯 芒疟谩膷膽艜暮艡眉?
100526	3156	243587	DIA_RENGARU_ELITELOCKPICKOK_INFO	INFO_ADDCHOICE.PAR1	INFO_ADDCHOICE.PAR1	袛胁邪 屑械写芯胁褘褏 褌邪斜邪泻邪.	脛芒艜 臎暮盲卯芒疟艖 艌艜谩艜臋艜.
100529	-1	73071	DIA_RENGARU_ELITELOCKPICKOK_ITPO	"AI_OUTPUT(OTHER,SELF,""DIA_Rengaru_EliteLockpickOK_15_02"")"	SUBTITLE	袛胁邪 屑械写芯胁褘褏 褌邪斜邪泻邪.	脛芒艜 臎暮盲卯芒疟艖 艌艜谩艜臋艜.
100629	3157	243698	DIA_NAGUR_REWORK	C_INFO.DESCRIPTION	C_INFO.DESCRIPTION	携 锌芯薪懈屑邪褞, 褔褌芯 褌褘 屑薪械 薪械 写芯胁械褉褟械褕褜...	脽 膹卯铆膷臎艜牛, 梅艌卯 艌疟 臎铆暮 铆暮 盲卯芒暮膽藱暮艡眉...
100630	-1	73114	DIA_NAGUR_REWORK_INFO	"AI_OUTPUT(OTHER,SELF,""DIA_Nagur_reWork_15_00"")"	SUBTITLE	携 锌芯薪懈屑邪褞, 褔褌芯 褌褘 屑薪械 薪械 写芯胁械褉褟械褕褜, 薪芯 褟 褍卸械 懈屑械褞 薪械斜芯谢褜褕芯泄 胁械褋 胁 胁邪褕懈褏 写械谢邪褏.	脽 膹卯铆膷臎艜牛, 梅艌卯 艌疟 臎铆暮 铆暮 盲卯芒暮膽藱暮艡眉, 铆卯 藱 贸膰暮 膷臎暮牛 铆暮谩卯毛眉艡卯茅 芒暮艅 芒 芒艜艡膷艖 盲暮毛艜艖.
100631	-1	73114	DIA_NAGUR_REWORK_INFO	"AI_OUTPUT(SELF,OTHER,""DIA_Nagur_reWork_08_01"")"	SUBTITLE	啸屑屑. 协褌芯 写械泄褋褌胁懈褌械谢褜薪芯 褌邪泻, 褟 褍卸械 褋谢褘褕邪谢 芯 褌械斜械.	Hmm. 脻艌卯 盲暮茅艅艌芒膷艌暮毛眉铆卯 艌艜臋, 藱 贸膰暮 艅毛疟艡艜毛 卯 艌暮谩暮.
100632	-1	73114	DIA_NAGUR_REWORK_INFO	"AI_OUTPUT(SELF,OTHER,""DIA_Nagur_reWork_08_02"")"	SUBTITLE	袥邪写薪芯, 褟 写邪屑 褌械斜械 褕邪薪褋. 袩芯谐芯胁芯褉懈 褋 袣邪褉写懈褎芯屑.	脣艜盲铆卯, 藱 盲艜臎 艌暮谩暮 艡艜铆艅. 膸卯膬卯芒卯膽膷 艅 臉艜膽盲膷么卯臎.
100633	3157	243702	DIA_NAGUR_REWORK_INFO	B_LOGENTRY.ENTRY	LOG_ADDENTRY.PAR1	袧邪谐褍褉 褌芯褉谐褍械褌 械写芯泄 薪邪 褋泻谢邪写械 胁 谐邪胁邪薪懈.	Nagur sprzedaje jedzenie w magazynie w porcie.
100808	-1	73206	DIA_ATTILA_GUARDSAW_INFO	"AI_OUTPUT(SELF,OTHER,""DIA_Melhior_GuardSaw_12_06"")"	SUBTITLE	小褌芯懈褌 锌芯褋锌褉邪褕懈胁邪褌褜 写械褋褟褌薪懈泻邪 谐芯褉芯写褋泻芯泄 褋褌褉邪卸懈. 袨薪 胁 芯褋芯斜褘褏 写芯褋锌械褏邪褏. 袦芯卸械褌, 泻褌芯-褌芯 懈蟹 胁械褔械褉薪械泄 褋屑械薪褘 锌褉懈屑械褌懈谢 锌芯写芯蟹褉懈褌械谢褜薪褘褏 谢褞写械泄 懈 褋芯芯斜褖懈谢 薪邪褔邪谢褜褋褌胁褍.	艃艌卯膷艌 膹卯艅膹膽艜艡膷芒艜艌眉 盲暮艅藱艌铆膷臋艜 膬卯膽卯盲艅臋卯茅 艅艌膽艜膰膷. 脦铆 芒 卯艅卯谩疟艖 盲卯艅膹暮艖艜艖. 臍卯膰暮艌, 臋艌卯-艌卯 膷莽 芒暮梅暮膽铆暮茅 艅臎暮铆疟 膹膽膷臎暮艌膷毛 膹卯盲卯莽膽膷艌暮毛眉铆疟艖 毛牛盲暮茅 膷 艅卯卯谩暖膷毛 铆艜梅艜毛眉艅艌芒贸.
100920	-1	73268	DIA_IGNAZ_MUSHROOM_INFO	"AI_OUTPUT(OTHER,SELF,""DIA_Ignaz_Mushroom_15_02"")"	SUBTITLE	(锌械褉械斜懈胁邪械褌) 孝褘 褏芯褔械褕褜, 褔褌芯斜褘 褟 薪邪褕械谢 褍 薪械谐芯 懈薪褎芯褉屑邪褑懈褞 锌芯 谐褉懈斜邪屑?	(膹暮膽暮谩膷芒艜暮艌) 艊疟 艖卯梅暮艡眉, 梅艌卯谩疟 藱 铆艜艡暮毛 贸 铆暮膬卯 膷铆么卯膽臎艜枚膷牛 膹卯 膬膽膷谩艜臎?
100926	-1	73268	DIA_IGNAZ_MUSHROOM_INFO	"AI_OUTPUT(SELF,OTHER,""DIA_Ignaz_Mushroom_14_09"")"	SUBTITLE	携 锌褉芯褔懈褌邪谢 泻薪懈谐褍, 薪械 蟹薪邪褟 褝褌芯谐芯, 懈 褋谢褍褔邪泄薪芯 蟹邪褋械褟谢 谐芯褉芯写 懈 械谐芯 芯泻褉械褋褌薪芯褋褌懈 懈屑懈.	脽 膹膽卯梅膷艌艜毛 臋铆膷膬贸, 铆暮 莽铆艜藱 媒艌卯膬卯, 膷 艅毛贸梅艜茅铆卯 莽艜艅暮藱毛 膬卯膽卯盲 膷 暮膬卯 卯臋膽暮艅艌铆卯艅艌膷 膷臎膷.
100927	-1	73268	DIA_IGNAZ_MUSHROOM_INFO	"AI_OUTPUT(SELF,OTHER,""DIA_Ignaz_Mushroom_14_10"")"	SUBTITLE	袞懈褌械谢懈 褋芯斜褉邪谢懈 胁褋械, 褟 懈 谐谢邪蟹芯屑 屑芯褉谐薪褍褌褜 薪械 褍褋锌械谢.	膯膷艌暮毛膷 艅卯谩膽艜毛膷 芒艅暮, 藱 膷 膬毛艜莽卯臎 臎卯膽膬铆贸艌眉 铆暮 贸艅膹暮毛.
100930	-1	73268	DIA_IGNAZ_MUSHROOM_INFO	"AI_OUTPUT(SELF,OTHER,""DIA_Ignaz_Mushroom_14_11"")"	SUBTITLE	袚褉懈斜褘, 泻芯褌芯褉褘械 锌褉芯褉芯褋谢懈 胁 谐芯褉芯写械, 褍卸械 褋芯斜褉邪谢懈. 袧芯 胁芯蟹谢械 谐芯褉芯写邪 懈 谐芯褉芯写褋泻懈褏 褋褌械薪 屑芯谐谢懈 薪械 薪邪泄褌懈.	膫膽膷谩疟, 臋卯艌卯膽疟暮 膹膽卯膽卯艅毛膷 芒 膬卯膽卯盲暮, 贸膰暮 艅卯谩膽艜毛膷. 脥卯 芒卯莽毛暮 膬卯膽卯盲艜 膷 膬卯膽卯盲艅臋膷艖 艅艌暮铆 臎卯膬毛膷 铆暮 铆艜茅艌膷.
100931	-1	73268	DIA_IGNAZ_MUSHROOM_INFO	"AI_OUTPUT(SELF,OTHER,""DIA_Ignaz_Mushroom_14_12"")"	SUBTITLE	袦薪械 薪褍卸薪芯 褏芯褌褟 斜褘 锌芯 褌褉懈 芯斜褉邪蟹褑邪 泻邪卸写芯谐芯 胁懈写邪. 袩褉芯褔懈褌邪泄 泻薪懈谐褍, 褔褌芯斜褘 锌褉懈屑械褉薪芯 锌芯薪褟褌褜, 谐写械 懈褋泻邪褌褜 谐褉懈斜褘.	臍铆暮 铆贸膰铆卯 艖卯艌藱 谩疟 膹卯 艌膽膷 卯谩膽艜莽枚艜 臋艜膰盲卯膬卯 芒膷盲艜. 膸膽卯梅膷艌艜茅 臋铆膷膬贸, 梅艌卯谩疟 膹膽膷臎暮膽铆卯 膹卯铆藱艌眉, 膬盲暮 膷艅臋艜艌眉 膬膽膷谩疟.
100932	-1	73268	DIA_IGNAZ_MUSHROOM_INFO	"AI_OUTPUT(SELF,OTHER,""DIA_Ignaz_Mushroom_14_13"")"	SUBTITLE	袙芯蟹谢械 褋褌械薪 芯褋屑芯褌褉懈 锌褉芯谢械褋芯泻, 褌邪屑 写芯谢卸薪褘 斜褘褌褜 谢械褋薪褘械 懈 谢褍谐芯胁褘械 谐褉懈斜褘. 袧邪 褋泻邪谢邪褏 写褉褍谐懈械, 薪邪 锌械薪褜泻邪褏 褌械, 泻芯褌芯褉褘械 谢褞斜褟褌 褌褉褍褏谢褟胁褍褞 写褉械胁械褋懈薪褍. 袧褍 懈 胁 褌械薪褜泻械 懈 褍谐谢邪褏 写芯谢卸薪褘 斜褘褌褜 胁褋褟泻懈械 锌芯谐邪薪泻懈.	脗卯莽毛暮 艅艌暮铆 卯艅臎卯艌膽膷 膹膽卯毛暮艅卯臋, 艌艜臎 盲卯毛膰铆疟 谩疟艌眉 毛暮艅铆疟暮 膷 毛贸膬卯芒疟暮 膬膽膷谩疟. 脥艜 艅臋艜毛艜艖 盲膽贸膬膷暮, 铆艜 膹暮铆眉臋艜艖 艌暮, 臋卯艌卯膽疟暮 毛牛谩藱艌 艌膽贸艖毛藱芒贸牛 盲膽暮芒暮艅膷铆贸. 脥贸 膷 芒 艌暮铆眉臋暮 膷 贸膬毛艜艖 盲卯毛膰铆疟 谩疟艌眉 芒艅藱臋膷暮 膹卯膬艜铆臋膷.
100933	-1	73268	DIA_IGNAZ_MUSHROOM_INFO	"AI_OUTPUT(SELF,OTHER,""DIA_Ignaz_Mushroom_14_14"")"	SUBTITLE	袗 胁芯褌 谐写械 懈褋泻邪褌褜 蟹芯谢芯褌褍褞 褔邪褕褍 懈 谐褉懈斜-褋械褉写褑械 褟 褍屑邪 薪械 锌褉懈谢芯卸褍. 协褌芯 写芯谢卸薪褘 斜褘褌褜 屑械褋褌邪, 锌芯谢薪褘械 褋懈谢褘, 褋胁械褌谢芯泄 懈 褌械屑薪芯泄.	艛 芒卯艌 膬盲暮 膷艅臋艜艌眉 莽卯毛卯艌贸牛 梅艜艡贸 膷 膬膽膷谩-艅暮膽盲枚暮 藱 贸臎艜 铆暮 膹膽膷毛卯膰贸. 脻艌卯 盲卯毛膰铆疟 谩疟艌眉 臎暮艅艌艜, 膹卯毛铆疟暮 艅膷毛疟, 艅芒暮艌毛卯茅 膷 艌暮臎铆卯茅.
100934	3159	244013	DIA_IGNAZ_MUSHROOM_INFO	B_STARTMISSION.FIRSTNOTE	LOG_ADDENTRY.PAR1	袠谐薪邪褑 胁褉褍褔懈谢 屑薪械 泻薪懈谐褍 袣芯薪褋褌邪薪褌懈薪芯 芯 谐褉懈斜邪褏, 懈蟹 泻芯褌芯褉芯泄 褉邪蟹谢械褌械谢懈褋褜 褋锌芯褉褘 锌芯 谐芯褉芯写褍 懈 胁芯蟹谢械 薪械谐芯. 小褉邪胁薪懈胁邪褟褋褜 褋 泻薪懈谐芯泄, 褟 写芯谢卸械薪 薪邪泄褌懈 褏芯褌褟 斜褘 锌芯 3 芯斜褉邪蟹褑邪 泻邪卸写芯谐芯 谐褉懈斜邪.	膶膬铆艜枚 芒膽贸梅膷毛 臎铆暮 臋铆膷膬贸 臉卯铆艅艌艜铆艌膷铆卯 卯 膬膽膷谩艜艖, 膷莽 臋卯艌卯膽卯茅 膽艜莽毛暮艌暮毛膷艅眉 艅膹卯膽疟 膹卯 膬卯膽卯盲贸 膷 芒卯莽毛暮 铆暮膬卯. 艃膽艜芒铆膷芒艜藱艅眉 艅 臋铆膷膬卯茅, 藱 盲卯毛膰暮铆 铆艜茅艌膷 艖卯艌藱 谩疟 膹卯 3 卯谩膽艜莽枚艜 臋艜膰盲卯膬卯 膬膽膷谩艜.
100935	-1	73268	DIA_IGNAZ_MUSHROOM_INFO	"AI_OUTPUT(SELF,OTHER,""DIA_Ignaz_Mushroom_14_15"")"	SUBTITLE	袠 褍胁械谢懈褔褍 褌胁芯褞 泻芯褌芯屑泻褍 写谢褟 谐褉懈斜芯胁 懈 褌褉邪胁.	I w dodatku powi臋ksz臋 twoj膮 sakw臋 na grzyby i zio艂a.
100936	-1	73268	DIA_IGNAZ_MUSHROOM_INFO	"AI_OUTPUT(SELF,OTHER,""DIA_Ignaz_Mushroom_14_16"")"	SUBTITLE	袟邪 泻邪卸写褘械 写胁邪 芯斜褉邪蟹褑邪 懈蟹 褝褌芯泄 泻薪懈谐懈 褟 写芯斜邪胁谢褞 褌械斜械 锌芯 芯写薪芯屑褍 屑械褋褌褍 胁 泻芯褌芯屑泻械.	脟艜 臋艜膰盲疟暮 盲芒艜 卯谩膽艜莽枚艜 膷莽 媒艌卯茅 臋铆膷膬膷 藱 盲卯谩艜芒毛牛 艌暮谩暮 膹卯 卯盲铆卯臎贸 臎暮艅艌贸 芒 臋卯艌卯臎臋暮.
100937	3159	244016	DIA_IGNAZ_MUSHROOM_INFO	B_LOGENTRY_QUIET.ENTRY	LOG_ADDENTRY.PAR1	袟邪 泻邪卸写褘械 2 谐褉懈斜邪 懈蟹 泻薪懈谐懈 袠谐薪邪褑 写芯斜邪胁懈褌 屑薪械 锌芯 芯写薪芯屑褍 屑械褋褌褍 胁 泻芯褌芯屑泻械 写谢褟 褌褉邪胁 懈 谐褉懈斜芯胁.	脟艜 臋艜膰盲疟暮 2 膬膽膷谩艜 膷莽 臋铆膷膬膷 膶膬铆艜枚 盲卯谩艜芒膷艌 臎铆暮 膹卯 卯盲铆卯臎贸 臎暮艅艌贸 芒 臋卯艌卯臎臋暮 盲毛藱 艌膽艜芒 膷 膬膽膷谩卯芒.
100939	-1	73268	DIA_IGNAZ_MUSHROOM_INFO	"AI_OUTPUT(SELF,OTHER,""DIA_Ignaz_Mushroom_14_17"")"	SUBTITLE	袙褋械 蟹邪胁懈褋懈褌 芯褌 褌械斜褟. 袙芯褌 泻薪懈谐邪.	Wszystko zale偶y od ciebie. Oto ksi膮偶ka.
100962	3159	244041	DIA_IGNAZ_MUSHROOMOK_INFO	CONCATSTRINGS.PAR1	PRINTSCREEN.PAR0	1 蟹邪 泻邪卸写褍褞 锌邪褉褌懈褞 谐褉懈斜芯胁.	1 莽艜 臋艜膰盲贸牛 膹艜膽艌膷牛 膬膽膷谩卯芒.
100966	-1	73273	DIA_IGNAZ_MUSHROOMOK_INFO	"AI_OUTPUT(SELF,OTHER,""DIA_Ignaz_MushroomOK_14_04"")"	SUBTITLE	孝褘 褏芯褉芯褕芯 锌芯褌褉褍写懈谢褋褟, 褉邪蟹褘褋泻懈胁邪褟 胁褋械 褝褌懈 谐褉懈斜褘	艊疟 艖卯膽卯艡卯 膹卯艌膽贸盲膷毛艅藱, 膽艜莽疟艅臋膷芒艜藱 芒艅暮 媒艌膷 膬膽膷谩疟
100967	-1	73273	DIA_IGNAZ_MUSHROOMOK_INFO	"AI_OUTPUT(SELF,OTHER,""DIA_Ignaz_MushroomOK_14_05"")"	SUBTITLE	袣芯薪褋褌邪薪褌懈薪芯 褍胁械褉械薪, 褔褌芯 泻薪懈谐褍 褍 薪械谐芯 褍泻褉邪谢 泻褌芯-褌芯 懈蟹 胁械褉褏薪械谐芯 泻胁邪褉褌邪谢邪, 泻褌芯 斜褘谢 斜褘 蟹邪懈薪褌械褉械褋芯胁邪薪 胁 褉械写泻懈褏 懈 写芯褉芯谐懈褏 谐褉懈斜邪褏.	臉卯铆艅艌艜铆艌膷铆卯 贸芒暮膽暮铆, 梅艌卯 臋铆膷膬贸 贸 铆暮膬卯 贸臋膽艜毛 臋艌卯-艌卯 膷莽 芒暮膽艖铆暮膬卯 臋芒艜膽艌艜毛艜, 臋艌卯 谩疟毛 谩疟 莽艜膷铆艌暮膽暮艅卯芒艜铆 芒 膽暮盲臋膷艖 膷 盲卯膽卯膬膷艖 膬膽膷谩艜艖.
101215	3160	244299	DIA_MELAR_CAMILLAKNOW	C_INFO.DESCRIPTION	C_INFO.DESCRIPTION	孝褘 蟹薪邪械褕褜 袣邪屑懈谢谢褍?	艊疟 莽铆艜暮艡眉 臉艜臎膷毛毛贸?
101216	-1	73373	DIA_MELAR_CAMILLAKNOW_INFO	"AI_OUTPUT(OTHER,SELF,""DIA_Melar_CamillaKnow_15_01"")"	SUBTITLE	孝褘 蟹薪邪械褕褜 袣邪屑懈谢谢褍?	艊疟 莽铆艜暮艡眉 臉艜臎膷毛毛贸?
101217	-1	73373	DIA_MELAR_CAMILLAKNOW_INFO	"AI_OUTPUT(SELF,OTHER,""DIA_Melar_CamillaKnow_08_02"")"	SUBTITLE	袛邪, 泻芯薪械褔薪芯.	Tak, ch臋tnie.
101218	-1	73373	DIA_MELAR_CAMILLAKNOW_INFO	"AI_OUTPUT(SELF,OTHER,""DIA_Melar_CamillaKnow_08_03"")"	SUBTITLE	效邪褋褌芯 锌褉懈褏芯写懈谢邪 泻芯 屑薪械.	脳艜艅艌卯 膹膽膷艖卯盲膷毛艜 臋卯 臎铆暮.
101219	-1	73373	DIA_MELAR_CAMILLAKNOW_INFO	"AI_OUTPUT(OTHER,SELF,""DIA_Melar_CamillaKnow_15_04"")"	SUBTITLE	小 泻邪泻芯泄 褑械谢褜褞?	艃 臋艜臋卯茅 枚暮毛眉牛?
101220	-1	73373	DIA_MELAR_CAMILLAKNOW_INFO	"AI_OUTPUT(SELF,OTHER,""DIA_Melar_CamillaKnow_08_05"")"	SUBTITLE	袨薪邪 芯斜芯卸邪谢邪 褟斜谢芯褔薪褘泄 褌邪斜邪泻.	脦铆艜 卯谩卯膰艜毛艜 藱谩毛卯梅铆疟茅 艌艜谩艜臋.
101221	-1	73373	DIA_MELAR_CAMILLAKNOW_INFO	"AI_OUTPUT(OTHER,SELF,""DIA_Melar_CamillaKnow_15_06"")"	SUBTITLE	协褌芯 懈薪褌械褉械褋薪芯, 锌芯褌芯屑褍 褔褌芯 芯薪邪 屑械褉褌胁邪.	脻艌卯 膷铆艌暮膽暮艅铆卯, 膹卯艌卯臎贸 梅艌卯 卯铆艜 臎暮膽艌芒艜.
101222	-1	73373	DIA_MELAR_CAMILLAKNOW_INFO	"AI_OUTPUT(SELF,OTHER,""DIA_Melar_CamillaKnow_08_07"")"	SUBTITLE	(褋 褍卸邪褋芯屑) 效褌芯?	(艅 贸膰艜艅卯臎) Co?
101223	-1	73373	DIA_MELAR_CAMILLAKNOW_INFO	"AI_OUTPUT(SELF,OTHER,""DIA_Melar_CamillaKnow_08_08"")"	SUBTITLE	袦械褉褌胁邪?	臍暮膽艌芒艜?
101224	-1	73373	DIA_MELAR_CAMILLAKNOW_INFO	"AI_OUTPUT(OTHER,SELF,""DIA_Melar_CamillaKnow_15_09"")"	SUBTITLE	袛邪.	Tak.
101225	-1	73373	DIA_MELAR_CAMILLAKNOW_INFO	"AI_OUTPUT(OTHER,SELF,""DIA_Melar_CamillaKnow_15_10"")"	SUBTITLE	携 褏芯褌械谢 斜褘 胁蟹褟褌褜 薪械屑薪芯谐芯 褌胁芯械谐芯 褌邪斜邪泻邪.	脽 艖卯艌暮毛 谩疟 芒莽藱艌眉 铆暮臎铆卯膬卯 艌芒卯暮膬卯 艌艜谩艜臋艜.
101226	-1	73373	DIA_MELAR_CAMILLAKNOW_INFO	"AI_OUTPUT(SELF,OTHER,""DIA_Melar_CamillaKnow_08_11"")"	SUBTITLE	孝邪斜邪泻邪... 褏屑屑屑... 胁械褉芯褟褌薪芯, 褍 屑械薪褟 械谐芯 薪械褌.	艊艜谩艜臋艜... 艖臎臎臎... 芒暮膽卯藱艌铆卯, 贸 臎暮铆藱 暮膬卯 铆暮艌.
101227	-1	73373	DIA_MELAR_CAMILLAKNOW_INFO	"AI_OUTPUT(OTHER,SELF,""DIA_Melar_CamillaKnow_15_12"")"	SUBTITLE	孝芯褉褔懈褌 懈蟹 褌胁芯械谐芯 泻邪褉屑邪薪邪.	艊卯膽梅膷艌 膷莽 艌芒卯暮膬卯 臋艜膽臎艜铆艜.
101228	-1	73373	DIA_MELAR_CAMILLAKNOW_INFO	"AI_OUTPUT(SELF,OTHER,""DIA_Melar_CamillaKnow_08_13"")"	SUBTITLE	袗邪邪, 薪褍 写邪.	艛艜艜, 铆贸 盲艜.
101229	3160	244313	DIA_MELAR_CAMILLAKNOW_INFO	B_LOGENTRY.ENTRY	LOG_ADDENTRY.PAR1	袣邪屑懈谢谢邪 褔邪褋褌芯 泻褍褉懈谢邪 褍 袦械谢邪褉邪 褟斜谢芯褔薪褘泄 褌邪斜邪泻. 袧褍卸薪芯 械谐芯 懈褋褋谢械写芯胁邪褌褜.	臉艜臎膷毛毛艜 梅艜艅艌卯 臋贸膽膷毛艜 贸 臍暮毛艜膽艜 藱谩毛卯梅铆疟茅 艌艜谩艜臋. 脥贸膰铆卯 暮膬卯 膷艅艅毛暮盲卯芒艜艌眉.
101230	3160	244314	DIA_MELAR_SRODKI	C_INFO.DESCRIPTION	C_INFO.DESCRIPTION	孝褘 泻褍锌懈谢 褍 袦邪褌械薪邪 褍褋锌芯泻邪懈胁邪褞褖懈械 谢械泻邪褉褋褌胁邪.	艊疟 臋贸膹膷毛 贸 臍艜艌暮铆艜 贸艅膹卯臋艜膷芒艜牛暖膷暮 毛暮臋艜膽艅艌芒艜.
101231	-1	73376	DIA_MELAR_SRODKI_INFO	"AI_OUTPUT(OTHER,SELF,""DIA_Melar_srodki_15_01"")"	SUBTITLE	孝褘 泻褍锌懈谢 褍 袦邪褌械薪邪 褍褋锌芯泻邪懈胁邪褞褖懈械 谢械泻邪褉褋褌胁邪.	艊疟 臋贸膹膷毛 贸 臍艜艌暮铆艜 贸艅膹卯臋艜膷芒艜牛暖膷暮 毛暮臋艜膽艅艌芒艜.
101232	-1	73376	DIA_MELAR_SRODKI_INFO	"AI_OUTPUT(SELF,OTHER,""DIA_Melar_srodki_08_02"")"	SUBTITLE	袛邪, 褝褌芯 薪械 蟹邪锌褉械褖械薪芯.	脛艜, 媒艌卯 铆暮 莽艜膹膽暮暖暮铆卯.
