NR	FILENR	ID	SYMBOL	USE	TRACE	RU	PL
85767	-1	66921	DIA_SLD_6176_GASTON_HUNGER_INFO	"AI_OUTPUT(SELF,OTHER,""SLD_6021_Gaston_Hunger_Info_12_09"")"	SUBTITLE	孝褘 褔褌芯-褌芯 蟹邪屑褘褕谢褟械褕褜?	艊疟 梅艌卯-艌卯 莽艜臎疟艡毛藱暮艡眉?
85768	-1	66921	DIA_SLD_6176_GASTON_HUNGER_INFO	"AI_OUTPUT(OTHER,SELF,""SLD_6021_Gaston_Hunger_Info_15_10"")"	SUBTITLE	携? 袧械褌 ...	Ja? Ja?
85769	-1	66921	DIA_SLD_6176_GASTON_HUNGER_INFO	"AI_OUTPUT(SELF,OTHER,""SLD_6021_Gaston_Hunger_Info_12_11"")"	SUBTITLE	小褌褉邪薪薪芯 褌褘 泻芯 屑薪械 锌芯写谢懈蟹褘胁邪械褕褜褋褟.	艃艌膽艜铆铆卯 艌疟 臋卯 臎铆暮 膹卯盲毛膷莽疟芒艜暮艡眉艅藱.
85770	-1	66921	DIA_SLD_6176_GASTON_HUNGER_INFO	"AI_OUTPUT(OTHER,SELF,""SLD_6021_Gaston_Hunger_Info_15_12"")"	SUBTITLE	袛褉邪谐邪薪 薪械 屑芯卸械褌 锌芯泻懈薪褍褌褜 写械褉械胁薪褞, 邪 屑薪械 薪褍卸薪邪 械谐芯 锌芯屑芯褖褜.	脛膽艜膬艜铆 铆暮 臎卯膰暮艌 膹卯臋膷铆贸艌眉 盲暮膽暮芒铆牛, 艜 臎铆暮 铆贸膰铆艜 暮膬卯 膹卯臎卯暖眉.
85771	-1	66921	DIA_SLD_6176_GASTON_HUNGER_INFO	"AI_OUTPUT(SELF,OTHER,""SLD_6021_Gaston_Hunger_Info_12_13"")"	SUBTITLE	携 蟹薪邪谢 褝褌芯.	Wiedzia艂em, 偶e tak b臋dzie.
85772	-1	66921	DIA_SLD_6176_GASTON_HUNGER_INFO	"AI_OUTPUT(SELF,OTHER,""SLD_6021_Gaston_Hunger_Info_12_14"")"	SUBTITLE	袨写薪邪泻芯 褟 褌褍褌 薪械 锌褉懈褔械屑.	脦盲铆艜臋卯 藱 艌贸艌 铆暮 膹膽膷梅暮臎.
85773	-1	66921	DIA_SLD_6176_GASTON_HUNGER_INFO	"AI_OUTPUT(SELF,OTHER,""SLD_6021_Gaston_Hunger_Info_12_15"")"	SUBTITLE	袠写懈 褋 薪懈屑 泻褍写邪 褍谐芯写薪芯, 薪芯 锌芯褌芯褉芯锌懈褋褜.	膶盲膷 艅 铆膷臎 臋贸盲艜 贸膬卯盲铆卯, 铆卯 膹卯艌卯膽卯膹膷艅眉.
85774	-1	66921	DIA_SLD_6176_GASTON_HUNGER_INFO	"AI_OUTPUT(SELF,OTHER,""SLD_6021_Gaston_Hunger_Info_12_16"")"	SUBTITLE	袙邪谢褜写械屑邪褉 薪懈褔械谐芯 薪械 写芯谢卸械薪 芯斜 褝褌芯屑 蟹薪邪褌褜.	脗艜毛眉盲暮臎艜膽 铆膷梅暮膬卯 铆暮 盲卯毛膰暮铆 卯谩 媒艌卯臎 莽铆艜艌眉.
85775	3050	227936	DIA_SLD_6176_GASTON_HUNGER_INFO	B_LOGENTRY.ENTRY	LOG_ADDENTRY.PAR1	袚邪褋褌芯薪 胁褘褉胁邪谢 泻芯屑锌芯褌 袦邪褌懈谢褜写褘 锌褉褟屑芯-褌邪泻懈 褍 屑械薪褟 懈蟹 褉褍泻. 袧邪泻芯薪械褑, 褟 屑芯谐褍 褋 袛褉邪谐邪薪芯屑 芯褌锌褉邪胁谢褟褌褜褋褟 薪邪 芯褏芯褌褍 蟹邪 泻褉芯胁邪胁褘屑 锌邪写邪谢褜褖懈泻芯屑.	膫艜艅艌卯铆 芒疟膽芒艜毛 臋卯臎膹卯艌 臍艜艌膷毛眉盲疟 膹膽藱臎卯-艌艜臋膷 贸 臎暮铆藱 膷莽 膽贸臋. 脥艜臋卯铆暮枚, 藱 臎卯膬贸 艅 脛膽艜膬艜铆卯臎 卯艌膹膽艜芒毛藱艌眉艅藱 铆艜 卯艖卯艌贸 莽艜 臋膽卯芒艜芒疟臎 膹艜盲艜毛眉暖膷臋卯臎.
85776	-1	66921	DIA_SLD_6176_GASTON_HUNGER_INFO	"AI_OUTPUT(SELF,OTHER,""SLD_6021_Gaston_Hunger_Info_12_17"")"	SUBTITLE	袧芯 褝褌芯 胁 锌械褉胁褘泄 懈 锌芯褋谢械写薪懈泄 褉邪蟹.	脥卯 媒艌卯 芒 膹暮膽芒疟茅 膷 膹卯艅毛暮盲铆膷茅 膽艜莽.
85777	3050	227938	DIA_SLD_6176_GASTON_HUNGER_INFO	B_LOGENTRY.ENTRY	LOG_ADDENTRY.PAR1	袚邪褋褌芯薪 泻邪泻 褉邪蟹 锌芯械谢. 袙械褉芯褟褌薪芯, 褟 屑芯谐褍 锌褉械写谢芯卸懈褌褜 械屑褍 泻芯屑锌芯褌 袦邪褌懈谢褜写褘, 薪懈泻褌芯 薪械 屑芯卸械褌 芯褌泻邪蟹邪褌褜褋褟 芯褌 褝褌芯谐芯.	膫艜艅艌卯铆 臋艜臋 膽艜莽 膹卯暮毛. 脗暮膽卯藱艌铆卯, 藱 臎卯膬贸 膹膽暮盲毛卯膰膷艌眉 暮臎贸 臋卯臎膹卯艌 臍艜艌膷毛眉盲疟, 铆膷臋艌卯 铆暮 臎卯膰暮艌 卯艌臋艜莽艜艌眉艅藱 卯艌 媒艌卯膬卯.
85778	3050	227939	DIA_SLD_6178_LANDO_WIESTEHTS	C_INFO.DESCRIPTION	C_INFO.DESCRIPTION	袣邪泻 写械谢邪?	Jak si臋 masz?
85779	-1	66927	DIA_SLD_6178_LANDO_WIESTEHTS_INFO	"AI_OUTPUT(OTHER,SELF,""SLD_6023_Lando_Wiestehts_Info_15_01"")"	SUBTITLE	袣邪泻 写械谢邪?	Jak leci?
85780	-1	66927	DIA_SLD_6178_LANDO_WIESTEHTS_INFO	"AI_OUTPUT(SELF,OTHER,""SLD_6023_Lando_Wiestehts_Info_07_02"")"	SUBTITLE	袧械 屑芯褉芯褔褜 屑薪械 谐芯谢芯胁褍 褋胁芯械泄 斜芯谢褌芯胁薪械泄!	脥暮 臎卯膽卯梅眉 臎铆暮 膬卯毛卯芒贸 艅芒卯暮茅 谩卯毛艌卯芒铆暮茅!
85781	-1	66927	DIA_SLD_6178_LANDO_WIESTEHTS_INFO	"AI_OUTPUT(SELF,OTHER,""SLD_6023_Lando_Wiestehts_Info_07_03"")"	SUBTITLE	袠写懈 芯褌胁谢械泻邪泄 泻芯谐芯-薪懈斜褍写褜 写褉褍谐芯谐芯!	膶盲膷 卯艌芒毛暮臋艜茅 臋卯膬卯-铆膷谩贸盲眉 盲膽贸膬卯膬卯!
86054	-1	67106	DIA_STRF_7007_LUKAS_EXIT_INFO	"AI_OUTPUT(SELF,OTHER,""DIA_STRF_7007_Lukas_bonus_01"")"	SUBTITLE	袦褍卸懈泻, 褟 褋谢芯胁薪芯 蟹邪薪芯胁芯 褉芯写懈谢褋褟! 携 屑芯谐褍 褉邪斜芯褌邪褌褜 褌邪泻 卸械, 泻邪泻 袦邪褌褌械褍褋... (褋屑械械褌褋褟)	臍贸膰膷臋, 藱 艅毛卯芒铆卯 莽艜铆卯芒卯 膽卯盲膷毛艅藱! 脽 臎卯膬贸 膽艜谩卯艌艜艌眉 艌艜臋 膰暮, 臋艜臋 臍艜艌艌暮贸艅... (艅臎暮暮艌艅藱)
86055	3058	228241	DIA_STRF_7007_LUKAS_HI	C_INFO.DESCRIPTION	C_INFO.DESCRIPTION	袩褉懈胁械褌!	Cze艣膰!
86056	-1	67109	DIA_STRF_7007_LUKAS_HI_INFO	"AI_OUTPUT(OTHER,SELF,""DIA_STRF_7007_Lukas_Hi_01"")"	SUBTITLE	袩褉懈胁械褌!	Cze艣膰.
86057	-1	67109	DIA_STRF_7007_LUKAS_HI_INFO	"AI_OUTPUT(SELF,OTHER,""DIA_STRF_7007_Lukas_Hi_02"")"	SUBTITLE	袩懈褌褜 褏芯褔褍... 校褋褌邪谢 ...	膸膷艌眉 艖卯梅贸... 脫艅艌艜毛 ...
86058	-1	67109	DIA_STRF_7007_LUKAS_HI_INFO	"AI_OUTPUT(OTHER,SELF,""DIA_STRF_7007_Lukas_Hi_03"")"	SUBTITLE	啸屑, 褔褌芯?	艕臎, 梅艌卯?
86059	-1	67109	DIA_STRF_7007_LUKAS_HI_INFO	"AI_OUTPUT(SELF,OTHER,""DIA_STRF_7007_Lukas_Hi_04"")"	SUBTITLE	袦褍卸懈泻, 褟 薪械 屑芯谐褍 褌邪泻 斜芯谢褜褕械...	臍贸膰膷臋, 藱 铆暮 臎卯膬贸 艌艜臋 谩卯毛眉艡暮...
86060	3058	228246	DIA_STRF_7007_LUKAS_HELFEN	C_INFO.DESCRIPTION	C_INFO.DESCRIPTION	携 屑芯谐褍 褌械斜械 锌芯屑芯褔褜?	Mog臋 ci jako艣 pom贸c?
86061	-1	67112	DIA_STRF_7007_LUKAS_HELFEN_INFO	"AI_OUTPUT(OTHER,SELF,""DIA_STRF_7007_Lukas_Helfen_01"")"	SUBTITLE	携 屑芯谐褍 褌械斜械 锌芯屑芯褔褜?	Mog臋 ci jako艣 pom贸c?
86062	-1	67112	DIA_STRF_7007_LUKAS_HELFEN_INFO	"AI_OUTPUT(SELF,OTHER,""DIA_STRF_7007_Lukas_Helfen_02"")"	SUBTITLE	...褌芯褔薪芯...锌芯屑芯褔褜...	...艌卯梅铆卯...膹卯臎卯梅眉...
86063	-1	67112	DIA_STRF_7007_LUKAS_HELFEN_INFO	"AI_OUTPUT(OTHER,SELF,""DIA_STRF_7007_Lukas_Helfen_03"")"	SUBTITLE	袠 泻邪泻?	膶 臋艜臋?
86064	-1	67112	DIA_STRF_7007_LUKAS_HELFEN_INFO	"AI_OUTPUT(SELF,OTHER,""DIA_STRF_7007_Lukas_Helfen_04"")"	SUBTITLE	袙懈写械谢 写芯胁芯谢褜薪褍褞 褉芯卸褍 袦邪褌褌械褍褋邪? 袨薪 褉邪斜芯褌邪械褌 懈 褉邪斜芯褌邪械褌, 斜械蟹 芯褋褌邪薪芯胁芯泻 懈 卸邪谢芯斜...	脗膷盲暮毛 盲卯芒卯毛眉铆贸牛 膽卯膰贸 臍艜艌艌暮贸艅艜? 脦铆 膽艜谩卯艌艜暮艌 膷 膽艜谩卯艌艜暮艌, 谩暮莽 卯艅艌艜铆卯芒卯臋 膷 膰艜毛卯谩...
86065	-1	67112	DIA_STRF_7007_LUKAS_HELFEN_INFO	"AI_OUTPUT(SELF,OTHER,""DIA_STRF_7007_Lukas_Helfen_05"")"	SUBTITLE	袗 褟 锌芯谢 写薪褟 锌芯褉邪斜芯褌邪谢, 懈 褍卸械 薪邪 锌芯褋谢械写薪械屑 懈蟹写褘褏邪薪懈懈.	艛 藱 膹卯毛 盲铆藱 膹卯膽艜谩卯艌艜毛, 膷 贸膰暮 铆艜 膹卯艅毛暮盲铆暮臎 膷莽盲疟艖艜铆膷膷.
86066	-1	67112	DIA_STRF_7007_LUKAS_HELFEN_INFO	"AI_OUTPUT(SELF,OTHER,""DIA_STRF_7007_Lukas_Helfen_06"")"	SUBTITLE	(锌褘褏褌懈褌) 校蟹薪邪泄, 泻邪泻 芯薪 褝褌芯 写械谢邪械褌, 褟 褌邪泻 斜芯谢褜褕械 薪械 屑芯谐褍...	(膹疟艖艌膷艌) 脫莽铆艜茅, 臋艜臋 卯铆 媒艌卯 盲暮毛艜暮艌, 藱 艌艜臋 谩卯毛眉艡暮 铆暮 臎卯膬贸...
86067	3058	228253	DIA_STRF_7007_LUKAS_HELFEN_INFO	B_STARTMISSION.FIRSTNOTE	LOG_ADDENTRY.PAR1	袥褍泻邪褋 芯褔械薪褜 褋懈谢褜薪芯 褍褋褌邪械褌 芯褌 褉邪斜芯褌褘. 袨薪 褋泻邪蟹邪谢, 褔褌芯 袦邪褌褌械褍褋 褉邪斜芯褌邪械褌 褋褌芯谢褜泻芯 卸械, 薪芯 薪械 褍褋褌邪械褌 懈 胁褋械谐写邪 胁械褋械谢. 袧邪写芯 斜褍写械褌 褉邪蟹褍蟹薪邪褌褜 胁 褔械屑 写械谢芯...	脣贸臋艜艅 卯梅暮铆眉 艅膷毛眉铆卯 贸艅艌艜暮艌 卯艌 膽艜谩卯艌疟. 脦铆 艅臋艜莽艜毛, 梅艌卯 臍艜艌艌暮贸艅 膽艜谩卯艌艜暮艌 艅艌卯毛眉臋卯 膰暮, 铆卯 铆暮 贸艅艌艜暮艌 膷 芒艅暮膬盲艜 芒暮艅暮毛. 脥艜盲卯 谩贸盲暮艌 膽艜莽贸莽铆艜艌眉 芒 梅暮臎 盲暮毛卯...
86068	3058	228254	DIA_STRF_7007_LUKAS_MANGORAKRAUT	C_INFO.DESCRIPTION	C_INFO.DESCRIPTION	携 蟹薪邪褞 褋械泻褉械褌 斜芯写褉芯褋褌懈 袦邪褌褌械褍褋邪!	脽 莽铆艜牛 艅暮臋膽暮艌 谩卯盲膽卯艅艌膷 臍艜艌艌暮贸艅艜!
86069	-1	67115	DIA_STRF_7007_LUKAS_MANGORAKRAUT_INFO	"AI_OUTPUT(OTHER,SELF,""DIA_STRF_7007_Lukas_Mangorakraut_01"")"	SUBTITLE	携 蟹薪邪褞 褋械泻褉械褌 斜芯写褉芯褋褌懈 袦邪褌褌械褍褋邪!	脽 莽铆艜牛 艅暮臋膽暮艌 谩卯盲膽卯艅艌膷 臍艜艌艌暮贸艅艜!
86070	-1	67115	DIA_STRF_7007_LUKAS_MANGORAKRAUT_INFO	"AI_OUTPUT(SELF,OTHER,""DIA_STRF_7007_Lukas_Mangorakraut_02"")"	SUBTITLE	小械褉褜械蟹薪芯? 袪邪褋褋泻邪卸懈!	Powa偶nie? Powa偶nie?
86071	-1	67115	DIA_STRF_7007_LUKAS_MANGORAKRAUT_INFO	"AI_OUTPUT(OTHER,SELF,""DIA_STRF_7007_Lukas_Mangorakraut_03"")"	SUBTITLE	袦邪薪谐芯褉邪褑胁械褌! 协褌邪 褌褉邪胁邪 褌芯薪懈蟹懈褉褍械褌 懈 锌褉懈芯斜芯写褉褟械褌.	臍艜铆膬卯膽艜枚芒暮艌! 脻艌艜 艌膽艜芒艜 艌卯铆膷莽膷膽贸暮艌 膷 膹膽膷卯谩卯盲膽藱暮艌.
86072	-1	67115	DIA_STRF_7007_LUKAS_MANGORAKRAUT_INFO	"AI_OUTPUT(SELF,OTHER,""DIA_STRF_7007_Lukas_Mangorakraut_04"")"	SUBTITLE	携褋薪芯, 褟 褏芯褔褍 褝褌芯 褉邪褋褌械薪懈械, 懈薪邪褔械 褟 薪械 胁褘卸懈胁褍 懈 斜芯谢褜褕械 薪械 褋屑芯谐褍 褉邪斜芯褌邪褌褜.	脽艅铆卯, 藱 艖卯梅贸 媒艌卯 膽艜艅艌暮铆膷暮, 膷铆艜梅暮 藱 铆暮 芒疟膰膷芒贸 膷 谩卯毛眉艡暮 铆暮 艅臎卯膬贸 膽艜谩卯艌艜艌眉.
86073	3058	228259	DIA_STRF_7007_LUKAS_MANGORAKRAUT_INFO	B_LOGENTRY.ENTRY	LOG_ADDENTRY.PAR1	袩芯褋谢械 褌芯谐芯, 泻邪泻 袥褍泻邪褋 褍蟹薪邪谢 锌褉芯 袦邪薪谐芯褉邪褑胁械褌, 芯薪 蟹邪褏芯褌械谢, 褔褌芯斜褘 褟 锌褉懈薪械褋 械屑褍 褝褌褍 褌褉邪胁褍.	膸卯艅毛暮 艌卯膬卯, 臋艜臋 脣贸臋艜艅 贸莽铆艜毛 膹膽卯 臍艜铆膬卯膽艜枚芒暮艌, 卯铆 莽艜艖卯艌暮毛, 梅艌卯谩疟 藱 膹膽膷铆暮艅 暮臎贸 媒艌贸 艌膽艜芒贸.
86074	3058	228260	DIA_STRF_7007_LUKAS_MANGORAKRAUT_GEBEN	C_INFO.DESCRIPTION	C_INFO.DESCRIPTION	校 屑械薪褟 械褋褌褜 写谢褟 褌械斜褟 褌褉邪胁邪!	脫 臎暮铆藱 暮艅艌眉 盲毛藱 艌暮谩藱 艌膽艜芒艜!
86075	-1	67118	DIA_STRF_7007_LUKAS_MANGORAKRAUT_GEBEN_INFO	"AI_OUTPUT(OTHER,SELF,""DIA_STRF_7007_Lukas_Mangorakraut_geben_01"")"	SUBTITLE	校 屑械薪褟 械褋褌褜 写谢褟 褌械斜褟 褌褉邪胁邪!	脫 臎暮铆藱 暮艅艌眉 盲毛藱 艌暮谩藱 艌膽艜芒艜!
86076	-1	67118	DIA_STRF_7007_LUKAS_MANGORAKRAUT_GEBEN_INFO	"AI_OUTPUT(SELF,OTHER,""DIA_STRF_7007_Lukas_Mangorakraut_geben_02"")"	SUBTITLE	校褏 褌褘... 褟 褔褍胁褋褌胁褍褞 褋械斜褟... 锌褉械泻褉邪褋薪芯!	脫艖 艌疟... 藱 梅贸芒艅艌芒贸牛 艅暮谩藱... 膹膽暮臋膽艜艅铆卯!
86077	-1	67118	DIA_STRF_7007_LUKAS_MANGORAKRAUT_GEBEN_INFO	"AI_OUTPUT(SELF,OTHER,""DIA_STRF_7007_Lukas_Mangorakraut_geben_03"")"	SUBTITLE	袘芯谢褜褕芯械 褋锌邪褋懈斜芯! 袙芯褌, 胁芯蟹褜屑懈 薪械屑薪芯谐芯 褉褍写褘.	Dzi臋kuj臋 bardzo! 脗卯艌, 芒卯莽眉臎膷 铆暮臎铆卯膬卯 膽贸盲疟.
86078	3058	228264	DIA_STRF_7007_LUKAS_MANGORAKRAUT_GEBEN_INFO	B_SUCCESSMISSION.LASTNODE	LOG_ADDENTRY.PAR1	袥褍泻邪褋 褋褗械谢 袦邪薪谐芯褉邪褑胁械褌 懈 褌械锌械褉褜 屑芯卸械褌 褉邪斜芯褌邪褌褜 薪械 褔褍胁褋褌胁褍褟 褍褋褌邪谢芯褋褌懈.	脣贸臋艜艅 艅煤暮毛 臍艜铆膬卯膽艜枚芒暮艌 膷 艌暮膹暮膽眉 臎卯膰暮艌 膽艜谩卯艌艜艌眉 铆暮 梅贸芒艅艌芒贸藱 贸艅艌艜毛卯艅艌膷.
86079	3058	228265	DIA_STRF_7008_MATTHAUS_HI	C_INFO.DESCRIPTION	C_INFO.DESCRIPTION	袙褋械 胁 锌芯褉褟写泻械?	Wszystko w porz膮dku?
86080	-1	67124	DIA_STRF_7008_MATTHAUS_HI_INFO	"AI_OUTPUT(OTHER,SELF,""DIA_STRF_7008_Matthaus_Hi_01"")"	SUBTITLE	袙褋械 胁 锌芯褉褟写泻械?	Wszystko w porz膮dku?
86081	-1	67124	DIA_STRF_7008_MATTHAUS_HI_INFO	"AI_OUTPUT(SELF,OTHER,""DIA_STRF_7008_Matthaus_Hi_02"")"	SUBTITLE	袝褋谢懈 胁褋械 胁 锌芯褉褟写泻械, 蟹邪褔械屑 褋锌褉邪褕懈胁邪械褕褜?	墓艅毛膷 芒艅暮 芒 膹卯膽藱盲臋暮, 莽艜梅暮臎 艅膹膽艜艡膷芒艜暮艡眉?
86082	-1	67124	DIA_STRF_7008_MATTHAUS_HI_INFO	"AI_OUTPUT(SELF,OTHER,""DIA_STRF_7008_Matthaus_Hi_03"")"	SUBTITLE	袣 褋褔邪褋褌褜褞, 褍 屑械薪褟 械褋褌褜 袦邪薪谐芯褉邪褑胁械褌.	臉 艅梅艜艅艌眉牛, 贸 臎暮铆藱 暮艅艌眉 臍艜铆膬卯膽艜枚芒暮艌.
86083	3058	228269	DIA_STRF_7008_MATTHAUS_HI_INFO	B_LOGENTRY.ENTRY	LOG_ADDENTRY.PAR1	袗谐邪, 胁褋械 褟褋薪芯, 写械谢芯 胁 褌褉邪胁械 袦邪薪谐芯褉邪褑胁械褌. 袧邪写芯 褉邪褋褋泻邪蟹邪褌褜 芯斜 褝褌芯屑 袥褍泻邪褋褍.	艛膬艜, 芒艅暮 藱艅铆卯, 盲暮毛卯 芒 艌膽艜芒暮 臍艜铆膬卯膽艜枚芒暮艌. 脥艜盲卯 膽艜艅艅臋艜莽艜艌眉 卯谩 媒艌卯臎 脣贸臋艜艅贸.
86084	3058	228270	DIA_STRF_7008_MATTHAUS_MANGORAKRAUT	C_INFO.DESCRIPTION	C_INFO.DESCRIPTION	效褌芯 写邪褞褌 褝褌懈 褌褉邪胁褘?	脳艌卯 盲艜牛艌 媒艌膷 艌膽艜芒疟? 
86085	-1	67127	DIA_STRF_7008_MATTHAUS_MANGORAKRAUT_INFO	"AI_OUTPUT(OTHER,SELF,""DIA_STRF_7008_Matthaus_Mangorakraut_01"")"	SUBTITLE	效褌芯 写邪褞褌 褝褌懈 褌褉邪胁褘?	脳艌卯 盲艜牛艌 媒艌膷 艌膽艜芒疟? 
86086	-1	67127	DIA_STRF_7008_MATTHAUS_MANGORAKRAUT_INFO	"AI_OUTPUT(SELF,OTHER,""DIA_STRF_7008_Matthaus_Mangorakraut_02"")"	SUBTITLE	袦邪薪谐芯褉邪褑胁械褌? 袨薪邪 泻邪泻 薪邪褉泻芯褌懈泻. 袨薪邪 锌褉懈写邪械褌 褋懈谢褘 懈 斜芯写褉芯褋褌懈, 泻芯谐写邪 褌褘 褍卸械 薪懈褔械谐芯 薪械 屑芯卸械褕褜 懈 锌芯谢薪芯褋褌褜褞 懈褋褌芯褖械薪.	臍艜铆膬卯膽艜枚芒暮艌? 脦铆艜 臋艜臋 铆艜膽臋卯艌膷臋. 脦铆艜 膹膽膷盲艜暮艌 艅膷毛疟 膷 谩卯盲膽卯艅艌膷, 臋卯膬盲艜 艌疟 贸膰暮 铆膷梅暮膬卯 铆暮 臎卯膰暮艡眉 膷 膹卯毛铆卯艅艌眉牛 膷艅艌卯暖暮铆. 
86087	-1	67127	DIA_STRF_7008_MATTHAUS_MANGORAKRAUT_INFO	"AI_OUTPUT(SELF,OTHER,""DIA_STRF_7008_Matthaus_Mangorakraut_03"")"	SUBTITLE	孝械屑 薪械 屑械薪械械, 屑芯泄 懈褋褌芯褔薪懈泻 褌褉邪胁褘 褋泻芯褉芯 懈褋褋褟泻薪械褌. 袦薪械 薪褍卸械薪 薪芯胁褘泄 懈褋褌芯褔薪懈泻.	艊暮臎 铆暮 臎暮铆暮暮, 臎卯茅 膷艅艌卯梅铆膷臋 艌膽艜芒疟 艅臋卯膽卯 膷艅艅藱臋铆暮艌. 臍铆暮 铆贸膰暮铆 铆卯芒疟茅 膷艅艌卯梅铆膷臋.
86088	3058	228274	DIA_STRF_7008_MATTHAUS_MANGORAKRAUT_BESORGEN	C_INFO.DESCRIPTION	C_INFO.DESCRIPTION	携 锌褉懈薪械褋褍 褌械斜械 褌褉邪胁褘.	脽 膹膽膷铆暮艅贸 艌暮谩暮 艌膽艜芒疟.
86089	-1	67130	DIA_STRF_7008_MATTHAUS_MANGORAKRAUT_BESORGEN_INFO	"AI_OUTPUT(OTHER,SELF,""DIA_STRF_7008_Matthaus_Mangorakraut_besorgen_01"")"	SUBTITLE	携 锌褉懈薪械褋褍 褌械斜械 褌褉邪胁褍.	脽 膹膽膷铆暮艅贸 艌暮谩暮 艌膽艜芒贸. 
86090	-1	67130	DIA_STRF_7008_MATTHAUS_MANGORAKRAUT_BESORGEN_INFO	"AI_OUTPUT(SELF,OTHER,""DIA_STRF_7008_Matthaus_Mangorakraut_besorgen_02"")"	SUBTITLE	袠 褌芯谐写邪 薪邪褋褌褍锌懈褌 褏芯褉芯褕械械 胁褉械屑褟. 袠 褟 写邪卸械 写邪屑 褌械斜械 薪邪谐褉邪写褍!	膶 艌卯膬盲艜 铆艜艅艌贸膹膷艌 艖卯膽卯艡暮暮 芒膽暮臎藱. 膶 藱 盲艜膰暮 盲艜臎 艌暮谩暮 铆艜膬膽艜盲贸! 
86091	-1	67130	DIA_STRF_7008_MATTHAUS_MANGORAKRAUT_BESORGEN_INFO	"AI_OUTPUT(OTHER,SELF,""DIA_STRF_7008_Matthaus_Mangorakraut_besorgen_03"")"	SUBTITLE	小械褉褜械蟹薪芯?	Powa偶nie?
86092	-1	67130	DIA_STRF_7008_MATTHAUS_MANGORAKRAUT_BESORGEN_INFO	"AI_OUTPUT(SELF,OTHER,""DIA_STRF_7008_Matthaus_Mangorakraut_besorgen_04"")"	SUBTITLE	袛邪. 孝芯谢褜泻芯 薪芯褔褜褞, 褔褌芯斜褘 薪械 锌褉懈胁谢械褔褜 胁薪懈屑邪薪懈褟. 袩褉懈薪械褋懈 屑薪械 5 褌褉邪胁!	Tak. 艊卯毛眉臋卯 铆卯梅眉牛, 梅艌卯谩疟 铆暮 膹膽膷芒毛暮梅眉 芒铆膷臎艜铆膷藱. 膸膽膷铆暮艅膷 臎铆暮 5 艌膽艜芒!
86093	3058	228279	DIA_STRF_7008_MATTHAUS_MANGORAKRAUT_BESORGEN_INFO	B_STARTMISSION.FIRSTNOTE	LOG_ADDENTRY.PAR1	袦邪褌褌械褍褋 锌芯锌褉芯褋懈谢 屑械薪褟 薪邪泄褌懈 写谢褟 薪械谐芯 5 褌褉邪胁 袦邪薪谐芯褉邪褑胁械褌. 袨薪 锌芯褋芯胁械褌芯胁邪谢 芯褌锌褉邪胁谢褟褌褜褋褟 薪邪 锌芯懈褋泻懈 薪芯褔褜褞.	臍艜艌艌暮贸艅 膹卯膹膽卯艅膷毛 臎暮铆藱 铆艜茅艌膷 盲毛藱 铆暮膬卯 5 艌膽艜芒 臍艜铆膬卯膽艜枚芒暮艌. 脦铆 膹卯艅卯芒暮艌卯芒艜毛 卯艌膹膽艜芒毛藱艌眉艅藱 铆艜 膹卯膷艅臋膷 铆卯梅眉牛.
86094	3058	228280	DIA_STRF_7008_MATTHAUS_MANGORAKRAUT_GEBEN	C_INFO.DESCRIPTION	C_INFO.DESCRIPTION	袙芯褌 褌褉邪胁邪!	脗卯艌 艌膽艜芒艜!
86095	-1	67133	DIA_STRF_7008_MATTHAUS_MANGORAKRAUT_GEBEN_INFO	"AI_OUTPUT(OTHER,SELF,""DIA_STRF_7008_Matthaus_Mangorakraut_geben_01"")"	SUBTITLE	袙芯褌 褌褉邪胁邪!	脗卯艌 艌膽艜芒艜! 
86096	3058	228282	DIA_STRF_7008_MATTHAUS_MANGORAKRAUT_GEBEN_INFO	B_SUCCESSMISSION.LASTNODE	LOG_ADDENTRY.PAR1	携 芯褌写邪谢 袦邪褌褌械褍褋褍 褌褉邪胁褍.	脽 卯艌盲艜毛 臍艜艌艌暮贸艅贸 艌膽艜芒贸.
86097	3058	228283	DIA_STRF_7008_MATTHAUS_MANGORAKRAUT_GEBEN_INFO	B_SUCCESSMISSION.LASTNODE	LOG_ADDENTRY.PAR1	携 芯褌写邪谢 袦邪褌褌械褍褋褍 褌褉邪胁褍.	脽 卯艌盲艜毛 臍艜艌艌暮贸艅贸 艌膽艜芒贸.
86098	-1	67133	DIA_STRF_7008_MATTHAUS_MANGORAKRAUT_GEBEN_INFO	"AI_OUTPUT(SELF,OTHER,""DIA_STRF_7008_Matthaus_Mangorakraut_geben_02"")"	SUBTITLE	小锌邪褋懈斜芯, 褌械斜械, 褟 褋屑芯褌褉褞, 褋芯锌褍褌褋褌胁芯胁邪谢邪 褍写邪褔邪. 协褌芯 卸械 锌褉械泻褉邪褋薪芯!	艃膹艜艅膷谩卯, 艌暮谩暮, 藱 艅臎卯艌膽牛, 艅卯膹贸艌艅艌芒卯芒艜毛艜 贸盲艜梅艜. 脻艌卯 膰暮 膹膽暮臋膽艜艅铆卯! 
86099	-1	67133	DIA_STRF_7008_MATTHAUS_MANGORAKRAUT_GEBEN_INFO	"AI_OUTPUT(SELF,OTHER,""DIA_STRF_7008_Matthaus_Mangorakraut_geben_03"")"	SUBTITLE	孝械锌械褉褜 褉邪斜芯褌邪褌褜 屑薪械 斜褍写械褌 薪邪屑薪芯谐芯 谢械谐褔械.	艊暮膹暮膽眉 膽艜谩卯艌艜艌眉 臎铆暮 谩贸盲暮艌 铆艜臎铆卯膬卯 毛暮膬梅暮. 
86100	-1	67133	DIA_STRF_7008_MATTHAUS_MANGORAKRAUT_GEBEN_INFO	"AI_OUTPUT(SELF,OTHER,""DIA_STRF_7008_Matthaus_Mangorakraut_geben_04"")"	SUBTITLE	袙芯褌, 胁芯蟹褜屑懈 泻芯谢褜褑芯. 携 胁褋械 褉邪胁薪芯 薪械 蟹薪邪褞 褔褌芯 褋 薪懈屑 写械谢邪褌褜.	Prosz臋, we藕 ten pier艣cie艅. 脽 芒艅暮 膽艜芒铆卯 铆暮 莽铆艜牛 梅艌卯 艅 铆膷臎 盲暮毛艜艌眉.
86101	3058	228287	DIA_STRF_7009_JOHANNES_HI	C_INFO.DESCRIPTION	C_INFO.DESCRIPTION	袣邪泻 写械谢邪?	Jak leci?
86102	-1	67139	DIA_STRF_7009_JOHANNES_HI_INFO	"AI_OUTPUT(OTHER,SELF,""DIA_STRF_7009_Johannes_Hi_01"")"	SUBTITLE	袣邪泻 写械谢邪?	Jak leci?
86103	-1	67139	DIA_STRF_7009_JOHANNES_HI_INFO	"AI_OUTPUT(SELF,OTHER,""DIA_STRF_7009_Johannes_Hi_02"")"	SUBTITLE	袧褍, 泻邪泻 胁懈写懈褕褜, 蟹写械褋褜 屑芯卸薪芯 褉邪斜芯褌邪褌褜, 褟 懈 褉邪斜芯褌邪褞.	脥贸, 臋艜臋 芒膷盲膷艡眉, 莽盲暮艅眉 臎卯膰铆卯 膽艜谩卯艌艜艌眉, 藱 膷 膽艜谩卯艌艜牛.
86104	-1	67139	DIA_STRF_7009_JOHANNES_HI_INFO	"AI_OUTPUT(SELF,OTHER,""DIA_STRF_7009_Johannes_Hi_03"")"	SUBTITLE	袙芯 胁褋褟泻芯屑褍 褋谢褍褔邪械, 褟 褉邪写, 褔褌芯 屑芯谐褍 褉邪斜芯褌邪褌褜 蟹写械褋褜. 袟写械褋褜 褍 屑械薪褟 械褋褌褜 褏芯褌褟 斜褘 写薪械胁薪芯械 芯褋胁械褖械薪懈械, 谐谢褍斜卸械 懈 褝褌芯谐芯 薪械褌.	脗卯 芒艅藱臋卯臎贸 艅毛贸梅艜暮, 藱 膽艜盲, 梅艌卯 臎卯膬贸 膽艜谩卯艌艜艌眉 莽盲暮艅眉. 脟盲暮艅眉 贸 臎暮铆藱 暮艅艌眉 艖卯艌藱 谩疟 盲铆暮芒铆卯暮 卯艅芒暮暖暮铆膷暮, 膬毛贸谩膰暮 膷 媒艌卯膬卯 铆暮艌.
86105	-1	67139	DIA_STRF_7009_JOHANNES_HI_INFO	"AI_OUTPUT(SELF,OTHER,""DIA_STRF_7009_Johannes_Hi_04"")"	SUBTITLE	孝邪泻 褔褌芯 屑薪械 薪械 薪邪 褔褌芯 卸邪谢芯胁邪褌褜褋褟. 袝写懈薪褋褌胁械薪薪邪褟 屑芯褟 锌褉芯斜谢械屑邪 - 褝褌芯 蟹邪褌褍锌懈胁褕邪褟褋褟 泻懈褉泻邪...	艊艜臋 梅艌卯 臎铆暮 铆暮 铆艜 梅艌卯 膰艜毛卯芒艜艌眉艅藱. 墓盲膷铆艅艌芒暮铆铆艜藱 臎卯藱 膹膽卯谩毛暮臎艜 - 媒艌卯 莽艜艌贸膹膷芒艡艜藱艅藱 臋膷膽臋艜...
86106	3058	228292	DIA_STRF_7009_JOHANNES_HELFEN	C_INFO.DESCRIPTION	C_INFO.DESCRIPTION	袦芯卸械褌, 褟 屑芯谐褍 褌械斜械 锌芯屑芯褔褜?	臍卯膰暮艌, 藱 臎卯膬贸 艌暮谩暮 膹卯臎卯梅眉?
86107	-1	67142	DIA_STRF_7009_JOHANNES_HELFEN_INFO	"AI_OUTPUT(OTHER,SELF,""DIA_STRF_7009_Johannes_Helfen_01"")"	SUBTITLE	袦芯卸械褌, 褟 屑芯谐褍 褌械斜械 锌芯屑芯褔褜?	臍卯膰暮艌, 藱 臎卯膬贸 艌暮谩暮 膹卯臎卯梅眉?
86108	-1	67142	DIA_STRF_7009_JOHANNES_HELFEN_INFO	"AI_OUTPUT(SELF,OTHER,""DIA_STRF_7009_Johannes_Helfen_02"")"	SUBTITLE	袛邪, 屑芯卸械褕褜.	脛艜, 臎卯膰暮艡眉.
86109	-1	67142	DIA_STRF_7009_JOHANNES_HELFEN_INFO	"AI_OUTPUT(SELF,OTHER,""DIA_STRF_7009_Johannes_Helfen_03"")"	SUBTITLE	携 写芯谐芯胁芯褉懈谢褋褟 褋 泻褍蟹薪械褑芯屑 挟褋褌褍褋芯屑, 褔褌芯 芯薪 褋写械谢邪械褌 屑薪械 薪芯胁褍褞 泻懈褉泻褍, 泻邪泻 褌芯谢褜泻芯 褍 薪械谐芯 斜褍写械褌 褋胁芯斜芯写薪芯械 胁褉械屑褟.	脽 盲卯膬卯芒卯膽膷毛艅藱 艅 臋贸莽铆暮枚卯臎 泞艅艌贸艅卯臎, 梅艌卯 卯铆 艅盲暮毛艜暮艌 臎铆暮 铆卯芒贸牛 臋膷膽臋贸, 臋艜臋 艌卯毛眉臋卯 贸 铆暮膬卯 谩贸盲暮艌 艅芒卯谩卯盲铆卯暮 芒膽暮臎藱.
86110	-1	67142	DIA_STRF_7009_JOHANNES_HELFEN_INFO	"AI_OUTPUT(SELF,OTHER,""DIA_STRF_7009_Johannes_Helfen_04"")"	SUBTITLE	袧芯 褍 薪械谐芯 褋褌芯谢褜泻芯 褉邪斜芯褌褘, 褔褌芯 薪械 懈蟹胁械褋褌薪芯, 泻芯谐写邪 褍 薪械谐芯 锌芯褟胁懈褌褋褟 褝褌芯 褋胁芯斜芯写薪芯械 胁褉械屑褟. 袗 褟 褍卸械 薪械 屑芯谐褍 褉邪斜芯褌邪褌褜 褋 褝褌芯泄 褕褌褍泻芯胁懈薪芯泄!	脥卯 贸 铆暮膬卯 艅艌卯毛眉臋卯 膽艜谩卯艌疟, 梅艌卯 铆暮 膷莽芒暮艅艌铆卯, 臋卯膬盲艜 贸 铆暮膬卯 膹卯藱芒膷艌艅藱 媒艌卯 艅芒卯谩卯盲铆卯暮 芒膽暮臎藱. 艛 藱 贸膰暮 铆暮 臎卯膬贸 膽艜谩卯艌艜艌眉 艅 媒艌卯茅 艡艌贸臋卯芒膷铆卯茅!
86111	-1	67142	DIA_STRF_7009_JOHANNES_HELFEN_INFO	"AI_OUTPUT(SELF,OTHER,""DIA_STRF_7009_Johannes_Helfen_05"")"	SUBTITLE	袝褋谢懈 褏芯褔械褕褜 锌芯屑芯褔褜, 蟹邪泄写懈 泻 薪械屑褍.	墓艅毛膷 艖卯梅暮艡眉 膹卯臎卯梅眉, 莽艜茅盲膷 臋 铆暮臎贸.
86112	3058	228298	DIA_STRF_7009_JOHANNES_HELFEN_INFO	B_STARTMISSION.FIRSTNOTE	LOG_ADDENTRY.PAR1	袣懈褉泻邪 袡芯褏邪薪薪械褋邪 褋懈谢褜薪芯 懈蟹薪芯褕械薪邪. 袨薪 锌芯锌褉芯褋懈谢 屑械薪褟 褋褏芯写懈褌褜 泻 泻褍蟹薪械褑褍 挟褋褌褍褋褍 懈 锌芯锌褉芯褋懈褌褜 褍 薪械谐芯 薪芯胁褍褞.	臉膷膽臋艜 脡卯艖艜铆铆暮艅艜 艅膷毛眉铆卯 膷莽铆卯艡暮铆艜. 脦铆 膹卯膹膽卯艅膷毛 臎暮铆藱 艅艖卯盲膷艌眉 臋 臋贸莽铆暮枚贸 泞艅艌贸艅贸 膷 膹卯膹膽卯艅膷艌眉 贸 铆暮膬卯 铆卯芒贸牛.
86113	3058	228299	DIA_STRF_7009_JOHANNES_HELFEN_FERTIG	C_INFO.DESCRIPTION	C_INFO.DESCRIPTION	校 屑械薪褟 械褋褌褜 薪芯胁邪褟 泻懈褉泻邪 写谢褟 褌械斜褟.	脫 臎暮铆藱 暮艅艌眉 铆卯芒艜藱 臋膷膽臋艜 盲毛藱 艌暮谩藱.
86114	-1	67145	DIA_STRF_7009_JOHANNES_HELFEN_FERTIG_INFO	"AI_OUTPUT(OTHER,SELF,""DIA_STRF_7009_Johannes_Helfen_fertig_01"")"	SUBTITLE	校 屑械薪褟 械褋褌褜 薪芯胁邪褟 泻懈褉泻邪 写谢褟 褌械斜褟.	脫 臎暮铆藱 暮艅艌眉 铆卯芒艜藱 臋膷膽臋艜 盲毛藱 艌暮谩藱.
