NR	FILENR	ID	SYMBOL	USE	TRACE	RU	PL
88065	3073	230365	DIA_TALIASAN_BUYBOOKS_DONE_YES	CONCATSTRINGS.PAR0	LOG_ADDENTRY.PAR1	袩褉懈薪械褋 袚邪谢谢邪褏邪写褍	膸膽膷铆暮艅 膫艜毛毛艜艖艜盲贸 
88066	3073	230366	DIA_TALIASAN_BUYBOOKS_DONE_YES	CONCATSTRINGS.PAR0	LOG_ADDENTRY.PAR1	袩褉懈薪械褋 袚邪谢谢邪褏邪写褍	膸膽膷铆暮艅 膫艜毛毛艜艖艜盲贸 
88067	3073	230367	DIA_TALIASAN_BUYBOOKS_DONE_YES	CONCATSTRINGS.PAR0	LOG_ADDENTRY.PAR1	袩褉懈薪械褋 袚邪谢谢邪褏邪写褍	膸膽膷铆暮艅 膫艜毛毛艜艖艜盲贸 
88068	3073	230368	DIA_TALIASAN_BUYBOOKS_DONE_YES	CONCATSTRINGS.PAR0	LOG_ADDENTRY.PAR1	袩褉懈薪械褋 袚邪谢谢邪褏邪写褍	膸膽膷铆暮艅 膫艜毛毛艜艖艜盲贸 
88069	3073	230369	DIA_TALIASAN_BUYBOOKS_DONE_YES	CONCATSTRINGS.PAR0	LOG_ADDENTRY.PAR1	袩褉懈薪械褋 袚邪谢谢邪褏邪写褍	膸膽膷铆暮艅 膫艜毛毛艜艖艜盲贸 
88070	3073	230370	DIA_TALIASAN_BUYBOOKS_DONE_YES	CONCATSTRINGS.PAR0	LOG_ADDENTRY.PAR1	袩褉懈薪械褋 袚邪谢谢邪褏邪写褍	膸膽膷铆暮艅 膫艜毛毛艜艖艜盲贸 
88071	3073	230371	DIA_TALIASAN_BUYBOOKS_DONE_YES	CONCATSTRINGS.PAR0	LOG_ADDENTRY.PAR1	袩褉懈薪械褋 袚邪谢谢邪褏邪写褍	膸膽膷铆暮艅 膫艜毛毛艜艖艜盲贸 
88072	3073	230372	DIA_TALIASAN_BUYBOOKS_DONE_YES	CONCATSTRINGS.PAR0	LOG_ADDENTRY.PAR1	袩褉懈薪械褋 袚邪谢谢邪褏邪写褍	膸膽膷铆暮艅 膫艜毛毛艜艖艜盲贸 
88073	3073	230373	DIA_TALIASAN_BUYBOOKS_DONE_YES	CONCATSTRINGS.PAR0	LOG_ADDENTRY.PAR1	袩褉懈薪械褋 袚邪谢谢邪褏邪写褍	膸膽膷铆暮艅 膫艜毛毛艜艖艜盲贸 
88074	3073	230374	DIA_TALIASAN_BUYBOOKS_DONE_YES	CONCATSTRINGS.PAR0	LOG_ADDENTRY.PAR1	袩褉懈薪械褋 袚邪谢谢邪褏邪写褍	膸膽膷铆暮艅 膫艜毛毛艜艖艜盲贸 
88075	3073	230375	DIA_TALIASAN_BUYBOOKS_DONE_YES	CONCATSTRINGS.PAR0	LOG_ADDENTRY.PAR1	袩褉懈薪械褋 袚邪谢谢邪褏邪写褍	膸膽膷铆暮艅 膫艜毛毛艜艖艜盲贸 
88076	3073	230376	DIA_TALIASAN_BUYBOOKS_DONE_YES	CONCATSTRINGS.PAR0	LOG_ADDENTRY.PAR1	袩褉懈薪械褋 袚邪谢谢邪褏邪写褍	膸膽膷铆暮艅 膫艜毛毛艜艖艜盲贸 
88077	3073	230377	DIA_TALIASAN_BUYBOOKS_DONE_YES	CONCATSTRINGS.PAR0	LOG_ADDENTRY.PAR1	袩褉懈薪械褋 袚邪谢谢邪褏邪写褍	膸膽膷铆暮艅 膫艜毛毛艜艖艜盲贸 
90014	3080	232387	DIA_FERNANDO_GOTBOOK_INFO	INFO_ADDCHOICE.PAR1	INFO_ADDCHOICE.PAR1	袘谢邪谐芯写邪褉褞.	Dobrze, interesy z tob膮 to prawdziwa przyjemno艣膰!
90015	-1	68315	DIA_FERNANDO_GOTBOOK_END	"AI_OUTPUT(OTHER,SELF,""DIA_Fernando_GotBook_01_09"")"	SUBTITLE	袘谢邪谐芯写邪褉褞.	Dobrze, interesy z tob膮 to prawdziwa przyjemno艣膰!
90016	-1	68315	DIA_FERNANDO_GOTBOOK_END	"AI_OUTPUT(SELF,OTHER,""DIA_Fernando_GotBook_01_14"")"	SUBTITLE	袦薪械 锌芯褉邪. 校胁懈写懈屑褋褟.	Musz臋 i艣膰! Do zobaczenia!
90017	3080	232390	DIA_FERNANDO_GOTBOOK_END	B_SUCCESSMISSION.LASTNODE	LOG_ADDENTRY.PAR1	袣邪泻 懈 芯斜械褖邪谢, 褟 锌褉懈薪械褋 肖械褉薪邪薪写芯 懈薪褌械褉械褋褍褞褖褍褞 械谐芯 泻薪懈谐褍. 袙 褋胁芯褞 芯褔械褉械写褜, 芯薪 薪邪锌懈褋邪谢 写谢褟 袚邪谢谢邪褏邪写邪 褉械泻芯屑械薪写邪褌械谢褜薪芯械 锌懈褋褜屑芯.	Fernando otrzyma艂 sw膮 ksi臋g臋, zgodnie z umow膮. W zamian da艂 mi list polecaj膮cy dla Gallahada.
90018	3080	232391	DIA_FERNANDO_GOTBOOK_END	B_LOGENTRY.ENTRY	LOG_ADDENTRY.PAR1	肖械褉薪邪薪写芯 薪邪锌懈褋邪谢 懈 锌械褉械写邪谢 屑薪械 褉械泻芯屑械薪写邪褑懈褞 写谢褟 袚邪谢谢邪褏邪写邪.	Fernando napisa艂 i przekaza艂 mi list polecaj膮cy dla Gallahada.
90192	3082	232596	DIA_HAKON_HAKONHELPS_INFO	B_LOGENTRY.ENTRY	LOG_ADDENTRY.PAR1	啸邪泻芯薪 锌芯褋谢械 芯谐褉邪斜谢械薪懈褟 斜邪薪写懈褌邪屑懈 芯褋褌邪谢褋褟 斜械蟹 褌芯胁邪褉邪 懈 薪械 褍褋锌械胁邪械褌 褋芯斜褉邪褌褜 薪褍卸薪褍褞 褋褍屑屑褍 写谢褟 芯锌谢邪褌褘 邪褉械薪写褘. 袧邪写芯 斜褘 锌芯褋锌褉邪褕懈胁邪褌褜 胁芯褉芯胁 懈谢懈 褋泻褍锌褖懈泻芯胁.	Hakon pozosta艂 bez d贸br po napadzie bandyt贸w i nie uda艂o mu si臋 zebra膰 kwoty niezb臋dnej do op艂acenia czynszu. 脥艜盲卯 谩疟 膹卯艅膹膽艜艡膷芒艜艌眉 芒卯膽卯芒 膷毛膷 艅臋贸膹暖膷臋卯芒.
90640	3084	233061	DIA_ZURIS_CHANGEPOTION_INFO	INFO_ADDCHOICE.PAR1	INFO_ADDCHOICE.PAR1	协泻褋褌褉邪泻褌褘 懈 褝褋褋械薪褑懈懈 卸懈蟹薪懈 薪邪 屑邪薪褍 (写芯锌谢邪褌邪 125 懈 250)	脻臋艅艌膽艜臋艌疟 膷 媒艅艅暮铆枚膷膷 膰膷莽铆膷 铆艜 臎艜铆贸 (盲卯膹毛艜艌艜 125 膷 250)
90641	3084	233062	DIA_ZURIS_CHANGEPOTION_INFO	INFO_ADDCHOICE.PAR1	INFO_ADDCHOICE.PAR1	协泻褋褌褉邪泻褌褘 懈 褝褋褋械薪褑懈懈 卸懈蟹薪懈 薪邪 胁褘薪芯褋谢懈胁芯褋褌褜 (写芯锌谢邪褌邪 125 懈 188)	脻臋艅艌膽艜臋艌疟 膷 媒艅艅暮铆枚膷膷 膰膷莽铆膷 铆艜 芒疟铆卯艅毛膷芒卯艅艌眉 (盲卯膹毛艜艌艜 125 膷 188)
90642	3084	233063	DIA_ZURIS_CHANGEPOTION_INFO	INFO_ADDCHOICE.PAR1	INFO_ADDCHOICE.PAR1	协泻褋褌褉邪泻褌褘 懈 褝褋褋械薪褑懈懈 屑邪薪褘 薪邪 卸懈蟹薪褜 (写芯锌谢邪褌邪 125 懈 188)	脻臋艅艌膽艜臋艌疟 膷 媒艅艅暮铆枚膷膷 臎艜铆疟 铆艜 膰膷莽铆眉 (盲卯膹毛艜艌艜 125 膷 188)
90643	3084	233064	DIA_ZURIS_CHANGEPOTION_INFO	INFO_ADDCHOICE.PAR1	INFO_ADDCHOICE.PAR1	协泻褋褌褉邪泻褌褘 懈 褝褋褋械薪褑懈懈 屑邪薪褘 薪邪 胁褘薪芯褋谢懈胁芯褋褌褜 (写芯锌谢邪褌邪 125 懈 188)	脻臋艅艌膽艜臋艌疟 膷 媒艅艅暮铆枚膷膷 臎艜铆疟 铆艜 芒疟铆卯艅毛膷芒卯艅艌眉 (盲卯膹毛艜艌艜 125 膷 188)
90644	3084	233065	DIA_ZURIS_CHANGEPOTION_INFO	INFO_ADDCHOICE.PAR1	INFO_ADDCHOICE.PAR1	协泻褋褌褉邪泻褌褘 懈 褝褋褋械薪褑懈懈 胁褘薪芯褋谢懈胁芯褋褌懈 薪邪 卸懈蟹薪褜 (写芯锌谢邪褌邪 125 懈 188)	脻臋艅艌膽艜臋艌疟 膷 媒艅艅暮铆枚膷膷 芒疟铆卯艅毛膷芒卯艅艌膷 铆艜 膰膷莽铆眉 (盲卯膹毛艜艌艜 125 膷 188)
90645	3084	233066	DIA_ZURIS_CHANGEPOTION_INFO	INFO_ADDCHOICE.PAR1	INFO_ADDCHOICE.PAR1	协泻褋褌褉邪泻褌褘 懈 褝褋褋械薪褑懈懈 胁褘薪芯褋谢懈胁芯褋褌懈 薪邪 屑邪薪褍 (写芯锌谢邪褌邪 125 懈 250)	脻臋艅艌膽艜臋艌疟 膷 媒艅艅暮铆枚膷膷 芒疟铆卯艅毛膷芒卯艅艌膷 铆艜 臎艜铆贸 (盲卯膹毛艜艌艜 125 膷 250)
90646	3084	233067	DIA_ZURIS_CHANGEPOTION_INFO	PRINTCENTER._TEXT_	PRINTSCREEN.PAR0	袧褍卸薪芯 125-188-250 蟹芯谢芯褌褘褏 薪邪 写芯锌谢邪褌褍!	脥贸膰铆卯 125-188-250 莽卯毛卯艌疟艖 铆艜 盲卯膹毛艜艌贸!
90794	-1	68679	DIA_PARLAF_TEACHSHARP1HSWORD_INFO	"AI_OUTPUT(OTHER,SELF,""DIA_Parlaf_TEACHSharp1HSword_15_00"")"	SUBTITLE	袧邪褍褔懈 屑械薪褟 泻芯胁邪褌褜.	Naucz mnie wykuwa膰 bro艅.
90795	-1	68679	DIA_PARLAF_TEACHSHARP1HSWORD_INFO	"AI_OUTPUT(SELF,OTHER,""DIA_Parlaf_Teach_Sharp1HSword_03_01"")"	SUBTITLE	啸芯褉芯褕芯, 褋屑芯褌褉懈 胁薪懈屑邪褌械谢褜薪芯, 泻邪泻 褝褌芯 写械谢邪械褌褋褟. 袙褋械, 褔褌芯 褌械斜械 薪褍卸薪芯, 褝褌芯 褉卸邪胁芯械 芯褉褍卸懈械 懈 蟹邪谐芯褌芯胁泻邪 泻谢懈薪泻邪.	C贸偶, patrz dok艂adnie jak to zrobi膰. Potrzebujesz broni i ostrzy.
90796	-1	68679	DIA_PARLAF_TEACHSHARP1HSWORD_INFO	"AI_OUTPUT(SELF,OTHER,""DIA_Parlaf_Teach_Sharp1HSword_03_02"")"	SUBTITLE	携 薪邪褍褔褍 褌械斜褟 蟹邪褌邪褔懈胁邪褌褜 袨袛袧袨袪校效袧蝎袝 屑械褔懈.	Naucz臋 ci臋 jak ostrzy膰 jednro臋czne miecze.
90797	-1	68679	DIA_PARLAF_TEACHSHARP1HSWORD_INFO	"AI_OUTPUT(SELF,OTHER,""DIA_Parlaf_Teach_Sharp1HSword_03_03"")"	SUBTITLE	袘械褉械褕褜 褉卸邪胁褘泄 屑械褔, 褋胁械褉褏褍 锌褉懈卸懈屑邪械褕褜 蟹邪谐芯褌芯胁泻芯泄 泻谢懈薪泻邪...	Bierzesz miecz i mocno naciskasz na oselk臋.
90798	-1	68679	DIA_PARLAF_TEACHSHARP1HSWORD_INFO	"AI_OUTPUT(SELF,OTHER,""DIA_Parlaf_Teach_Sharp1HSword_03_04"")"	SUBTITLE	...懈 锌谢邪胁薪芯 胁芯写懈褕褜 锌芯 褌芯褔懈谢褜薪芯屑褍 泻邪屑薪褞 胁锌褉邪胁芯-胁谢械胁芯...	...Przesuwasz ostrze z lewa na prawo...
90799	-1	68679	DIA_PARLAF_TEACHSHARP1HSWORD_INFO	"AI_OUTPUT(SELF,OTHER,""DIA_Parlaf_Teach_Sharp1HSword_03_05"")"	SUBTITLE	...蟹邪谐芯褌芯胁泻邪 泻谢懈薪泻邪 薪褍卸薪邪 写谢褟 斜芯谢械械 褉邪胁薪芯屑械褉薪芯谐芯 锌褉懈卸懈屑邪 屑械褔邪 泻 泻邪屑薪褞...	...Musisz to robi膰 do艣膰 delikatnie...
90800	-1	68679	DIA_PARLAF_TEACHSHARP1HSWORD_INFO	"AI_OUTPUT(SELF,OTHER,""DIA_Parlaf_Teach_Sharp1HSword_03_06"")"	SUBTITLE	...懈 褔褌芯斜褘 屑械褔 薪械 锌械褉械谐褉械胁邪谢褋褟 懈 薪械 懈蟹谐懈斜邪谢褋褟 锌褉懈 蟹邪褌芯褔泻械.	...i 偶eby miecz si臋 nie przegrza艂 i nie powygina艂 w trakcie ostrzenia...
90801	3087	233238	DIA_PARLAF_TEACHSHARP1HSWORD_INFO	B_LOGENTRY.ENTRY	LOG_ADDENTRY.PAR1	携 褍屑械褞 蟹邪褌邪褔懈胁邪褌褜 芯写薪芯褉褍褔薪褘械 屑械褔懈.	Wiem teraz, jak ostrzy膰 miecze jednor臋czne.
90802	-1	68679	DIA_PARLAF_TEACHSHARP1HSWORD_INFO	"AI_OUTPUT(SELF,OTHER,""DIA_Parlaf_Teach_Sharp1HSword_03_07"")"	SUBTITLE	...锌械褉胁芯械 胁褉械屑褟 褌褘 斜褍写械褕褜 褔邪褋褌芯 锌芯褉褌懈褌褜 蟹邪谐芯褌芯胁泻懈 泻谢懈薪泻邪..	...na poczatku mo偶e ci nie wychodzi膰...
90803	-1	68679	DIA_PARLAF_TEACHSHARP1HSWORD_INFO	"AI_OUTPUT(SELF,OTHER,""DIA_Parlaf_Teach_Sharp1HSword_03_08"")"	SUBTITLE	...薪芯 锌褉懈写械褌 胁褉械屑褟, 懈 褌褘 褋屑芯卸械褕褜 蟹邪褌邪褔懈胁邪褌褜 写褞卸懈薪褍 屑械褔械泄, 薪械 懈褋锌芯褉褌懈胁 薪懈 芯写薪芯谐芯 泻谢懈薪泻邪.	...przyjdzie czas, 偶e nauczysz si臋 ostrzy膰 kilkadziesi膮t mieczy, bez zniszczenia ani jednej sztuki.
90804	-1	68679	DIA_PARLAF_TEACHSHARP1HSWORD_INFO	"AI_OUTPUT(SELF,OTHER,""DIA_Parlaf_Teach_Sharp1HSword_03_09"")"	SUBTITLE	孝褘 褍卸械 写芯褋褌邪褌芯褔薪芯 芯锌褘褌械薪, 褔褌芯斜褘 褌芯褔懈褌褜 芯写薪芯褉褍褔薪褘械 屑械褔懈 薪械 锌芯褉褌褟 泻谢懈薪泻懈. 袗 褋 锌褉邪泻褌懈泻芯泄 懈 胁芯芯斜褖械 锌械褉械褋褌邪薪褍褌 谢芯屑邪褌褜褋褟.	Masz wystarczaj膮co du偶o do艣wiadczenia, aby naostrzy膰 jednor臋czne miecze nie niszcz膮c 偶adnego ostrza. Id藕 i sprawd藕 to w praktyce.
90805	-1	68679	DIA_PARLAF_TEACHSHARP1HSWORD_INFO	"AI_OUTPUT(OTHER,SELF,""DIA_Parlaf_Teach_Sharp1HSword_15_01"")"	SUBTITLE	袘谢邪谐芯写邪褉褞 蟹邪 薪邪褍泻褍.	脕毛艜膬卯盲艜膽牛 莽艜 铆艜贸臋贸.
91049	-1	68829	DIA_JERGAN_LEADER_INFO	"AI_OUTPUT(SELF,OTHER,""DIA_Jergan_Leader_13_02"")"	SUBTITLE	袨薪懈 褋褌芯褟褌 褑械谢芯械 褋芯褋褌芯褟薪懈械. 袝褋褌褜 谢褞写懈, 泻芯褌芯褉褘械 泻芯谢谢械泻褑懈芯薪懈褉褍褞褌 褌邪泻懈械 胁械褖懈.	脦铆膷 艅艌卯藱艌 枚暮毛卯暮 艅卯艅艌卯藱铆膷暮. 墓艅艌眉 毛牛盲膷, 臋卯艌卯膽疟暮 臋卯毛毛暮臋枚膷卯铆膷膽贸牛艌 艌艜臋膷暮 芒暮暖膷.
91051	-1	68829	DIA_JERGAN_LEADER_INFO	"AI_OUTPUT(OTHER,SELF,""DIA_Raoul_TROLLFELL_ja_15_00"")"	SUBTITLE	袩褉芯写邪薪芯.	Sprzedane.
91096	-1	68840	DIA_JERGAN_ABOUTEXPLORATION_INFO	"AI_OUTPUT(SELF,OTHER,""DIA_Jergan_AboutExploration_13_02"")"	SUBTITLE	袨薪 锌邪谢邪写懈薪, 懈 懈褋泻邪褌褜 锌芯写写械褉卸泻褍 褍 袠薪薪芯褋邪 - 锌褉邪胁懈谢褜薪芯.	脦铆 膹艜毛艜盲膷铆, 膷 膷艅臋艜艌眉 膹卯盲盲暮膽膰臋贸 贸 膶铆铆卯艅艜 - 膹膽艜芒膷毛眉铆卯.
91150	-1	68871	DIA_GRIMES_PERM_INFO	"AI_OUTPUT(OTHER,SELF,""DIA_Grimes_PERM_15_01"")"	SUBTITLE	袦芯卸械褌, 薪褍 械械, 褝褌褍 褉褍写褍? 袧械 卸械谢邪械褕褜 锌芯褋褌褍锌懈褌褜 泻 薪邪屑 薪邪 褋谢褍卸斜褍? 孝械斜械 锌褉芯褋褌褟褌 胁褋械 锌褉芯褕谢褘械 谐褉械褏懈...	臍卯膰暮艌, 铆贸 暮暮, 媒艌贸 膽贸盲贸? 脥暮 膰暮毛艜暮艡眉 膹卯艅艌贸膹膷艌眉 臋 铆艜臎 铆艜 艅毛贸膰谩贸? 艊暮谩暮 膹膽卯艅艌藱艌 芒艅暮 膹膽卯艡毛疟暮 膬膽暮艖膷...
91447	3096	233943	DIA_GAERTNER_ABOUTTEACH	C_INFO.DESCRIPTION	C_INFO.DESCRIPTION	孝褘 屑芯卸械褕褜 屑械薪褟 褔械屑褍-薪懈斜褍写褜 芯斜褍褔懈褌褜?,	艊疟 臎卯膰暮艡眉 臎暮铆藱 梅暮臎贸-铆膷谩贸盲眉 卯谩贸梅膷艌眉?,
91448	-1	68957	DIA_GAERTNER_ABOUTTEACH_INFO	"AI_OUTPUT(OTHER,SELF,""DIA_Gaertner_AboutTeach_15_00"")"	SUBTITLE	孝褘 屑芯卸械褕褜 屑械薪褟 褔械屑褍-薪懈斜褍写褜 芯斜褍褔懈褌褜?,	艊疟 臎卯膰暮艡眉 臎暮铆藱 梅暮臎贸-铆膷谩贸盲眉 卯谩贸梅膷艌眉?,
91449	-1	68957	DIA_GAERTNER_ABOUTTEACH_INFO	"AI_OUTPUT(SELF,OTHER,""DIA_Gaertner_AboutTeach_09_01"")"	SUBTITLE	小械泻褉械褌褘 锌芯 褍褏芯写褍 蟹邪 泻褉邪锌懈胁芯泄 芯褋褌邪薪褍褌褋褟 锌褉懈 屑薪械.	艃暮臋膽暮艌疟 膹卯 贸艖卯盲贸 莽艜 臋膽艜膹膷芒卯茅 卯艅艌艜铆贸艌艅藱 膹膽膷 臎铆暮.
91450	-1	68957	DIA_GAERTNER_ABOUTTEACH_INFO	"AI_OUTPUT(OTHER,SELF,""DIA_Gaertner_AboutTeach_15_01"")"	SUBTITLE	携 锌褉芯 芯褋芯斜褘械 褍屑械薪懈褟 写谢褟 褋胁芯懈褏, 械褋谢懈 褌褘 锌芯薪懈屑邪械褕褜.	脽 膹膽卯 卯艅卯谩疟暮 贸臎暮铆膷藱 盲毛藱 艅芒卯膷艖, 暮艅毛膷 艌疟 膹卯铆膷臎艜暮艡眉.
91451	-1	68957	DIA_GAERTNER_ABOUTTEACH_INFO	"AI_OUTPUT(OTHER,SELF,""DIA_Gaertner_AboutTeach_15_02"")"	SUBTITLE	(褋 薪邪卸懈屑芯屑) 袨褋芯斜褘械...	(艅 铆艜膰膷臎卯臎) 脦艅卯谩疟暮...
91452	-1	68957	DIA_GAERTNER_ABOUTTEACH_INFO	"AI_OUTPUT(SELF,OTHER,""DIA_Gaertner_AboutTeach_09_02"")"	SUBTITLE	袗邪, 锌芯薪褟谢. 孝芯谢褜泻芯 褔械屑褍 褟 屑芯谐褍 芯斜褍褔懈褌褜 褌械斜褟, 褌褘 懈 褋邪屑 胁懈写懈褕褜, 褔械屑 褟 蟹邪薪懈屑邪褞褋褜.	艛艜, 膹卯铆藱毛. 艊卯毛眉臋卯 梅暮臎贸 藱 臎卯膬贸 卯谩贸梅膷艌眉 艌暮谩藱, 艌疟 膷 艅艜臎 芒膷盲膷艡眉, 梅暮臎 藱 莽艜铆膷臎艜牛艅眉.
91453	-1	68957	DIA_GAERTNER_ABOUTTEACH_INFO	"AI_OUTPUT(OTHER,SELF,""DIA_Gaertner_AboutTeach_15_03"")"	SUBTITLE	袧械 锌褉懈斜械写薪褟泄褋褟, 薪邪胁械褉薪褟泻邪 褔褌芯-褌芯 械褋褌褜.	脥暮 膹膽膷谩暮盲铆藱茅艅藱, 铆艜芒暮膽铆藱臋艜 梅艌卯-艌卯 暮艅艌眉.
91454	-1	68957	DIA_GAERTNER_ABOUTTEACH_INFO	"AI_OUTPUT(SELF,OTHER,""DIA_Gaertner_AboutTeach_09_03"")"	SUBTITLE	啸屑. (芯褋屑邪褌褉懈胁邪械褌褋褟)	Hmm. (Hmm.)
91455	-1	68957	DIA_GAERTNER_ABOUTTEACH_INFO	"AI_OUTPUT(SELF,OTHER,""DIA_Gaertner_AboutTeach_09_04"")"	SUBTITLE	袦芯谐褍 褉邪褋褋泻邪蟹邪褌褜 芯 泻芯褉蟹懈薪泻邪褏.	臍卯膬贸 膽艜艅艅臋艜莽艜艌眉 卯 臋卯膽莽膷铆臋艜艖.
91456	-1	68957	DIA_GAERTNER_ABOUTTEACH_INFO	"AI_OUTPUT(OTHER,SELF,""DIA_Gaertner_AboutTeach_15_04"")"	SUBTITLE	效械谐芯-褔械谐芯?	脳暮膬卯-梅暮膬卯?
91457	-1	68957	DIA_GAERTNER_ABOUTTEACH_INFO	"AI_OUTPUT(SELF,OTHER,""DIA_Gaertner_AboutTeach_09_05"")"	SUBTITLE	袦邪谢芯 泻褌芯 蟹薪邪械褌, 薪芯 褋褉械写懈 斜械写薪褟泻芯胁 锌褉懈薪褟褌芯 锌褉褟褌邪褌褜 胁 泻芯褉蟹懈薪泻邪褏 褉邪蟹谢懈褔薪褘械 胁械褖懈.	臍艜毛卯 臋艌卯 莽铆艜暮艌, 铆卯 艅膽暮盲膷 谩暮盲铆藱臋卯芒 膹膽膷铆藱艌卯 膹膽藱艌艜艌眉 芒 臋卯膽莽膷铆臋艜艖 膽艜莽毛膷梅铆疟暮 芒暮暖膷.
91458	-1	68957	DIA_GAERTNER_ABOUTTEACH_INFO	"AI_OUTPUT(SELF,OTHER,""DIA_Gaertner_AboutTeach_09_06"")"	SUBTITLE	袛谢褟 褝褌芯谐芯 懈褋锌芯谢褜蟹褍褞褌 写胁芯泄薪褍褞 褋褌械薪泻褍 懈谢懈 写薪芯, 泻芯褌芯褉褘械 薪械蟹邪屑械褌薪褘 锌褉懈 褋谢褍褔邪泄薪芯泄 锌褉芯胁械褉泻械.	脛毛藱 媒艌卯膬卯 膷艅膹卯毛眉莽贸牛艌 盲芒卯茅铆贸牛 艅艌暮铆臋贸 膷毛膷 盲铆卯, 臋卯艌卯膽疟暮 铆暮莽艜臎暮艌铆疟 膹膽膷 艅毛贸梅艜茅铆卯茅 膹膽卯芒暮膽臋暮.
91459	-1	68957	DIA_GAERTNER_ABOUTTEACH_INFO	"AI_OUTPUT(OTHER,SELF,""DIA_Gaertner_AboutTeach_15_05"")"	SUBTITLE	袣褌芯 胁 蟹写褉邪胁芯屑 褍屑械 褋褌邪薪械褌 锌褉褟褌邪褌褜 褌邪屑 褔褌芯-褌芯 褑械薪薪芯械?	臉艌卯 芒 莽盲膽艜芒卯臎 贸臎暮 艅艌艜铆暮艌 膹膽藱艌艜艌眉 艌艜臎 梅艌卯-艌卯 枚暮铆铆卯暮?
91460	-1	68957	DIA_GAERTNER_ABOUTTEACH_INFO	"AI_OUTPUT(SELF,OTHER,""DIA_Gaertner_AboutTeach_09_07"")"	SUBTITLE	袗 泻褌芯 胁 蟹写褉邪胁芯屑 褍屑械 褋褌邪薪械褌 懈褋泻邪褌褜 褌邪屑 褔褌芯-褌芯 褑械薪薪芯械?	艛 臋艌卯 芒 莽盲膽艜芒卯臎 贸臎暮 艅艌艜铆暮艌 膷艅臋艜艌眉 艌艜臎 梅艌卯-艌卯 枚暮铆铆卯暮?
91461	-1	68957	DIA_GAERTNER_ABOUTTEACH_INFO	"AI_OUTPUT(SELF,OTHER,""DIA_Gaertner_AboutTeach_09_08"")"	SUBTITLE	袝褋谢懈 蟹邪锌谢邪褌懈褕褜, 薪邪褍褔褍 褌械斜褟 泻邪泻 锌褉芯胁械褉褟褌褜 褋褌械薪泻懈 懈 写薪芯 泻芯褉蟹懈薪.	墓艅毛膷 莽艜膹毛艜艌膷艡眉, 铆艜贸梅贸 艌暮谩藱 臋艜臋 膹膽卯芒暮膽藱艌眉 艅艌暮铆臋膷 膷 盲铆卯 臋卯膽莽膷铆.
91462	3096	233960	DIA_GAERTNER_ABOUTTEACH_INFO	B_LOGENTRY.ENTRY	LOG_ADDENTRY.PAR1	小邪写芯胁薪懈泻 屑芯卸械褌 芯斜褍褔懈褌褜 屑械薪褟 锌褉芯胁械褉泻械 写胁芯泄薪褘褏 褋褌械薪芯泻 懈 写薪邪 褍 泻芯褉蟹懈薪.	艃艜盲卯芒铆膷臋 臎卯膰暮艌 卯谩贸梅膷艌眉 臎暮铆藱 膹膽卯芒暮膽臋暮 盲芒卯茅铆疟艖 艅艌暮铆卯臋 膷 盲铆艜 贸 臋卯膽莽膷铆.
91463	-1	68960	DIA_GAERTNER_TEACH_INFO	"AI_OUTPUT(OTHER,SELF,""DIA_Gaertner_Teach_15_00"")"	SUBTITLE	袧邪褍褔懈 屑械薪褟 锌褉芯胁械褉褟褌褜 泻芯褉蟹懈薪褘.	脥艜贸梅膷 臎暮铆藱 膹膽卯芒暮膽藱艌眉 臋卯膽莽膷铆疟.
91464	-1	68960	DIA_GAERTNER_TEACH_INFO	"AI_OUTPUT(SELF,OTHER,""DIA_Gaertner_Teach_09_01"")"	SUBTITLE	袙 锌械褉胁褍褞 芯褔械褉械写褜 锌褉懈褋屑芯褌褉懈褋褜 泻芯 写薪褍 懈 泻褉褘褕泻械 泻芯褉蟹懈薪泻懈.	脗 膹暮膽芒贸牛 卯梅暮膽暮盲眉 膹膽膷艅臎卯艌膽膷艅眉 臋卯 盲铆贸 膷 臋膽疟艡臋暮 臋卯膽莽膷铆臋膷.
91465	-1	68960	DIA_GAERTNER_TEACH_INFO	"AI_OUTPUT(SELF,OTHER,""DIA_Gaertner_Teach_09_02"")"	SUBTITLE	袧械泻芯褌芯褉褘械 锌谢械褌褍褌 懈褏 褌邪泻, 褔褌芯斜褘 芯薪懈 斜褘谢懈 写胁芯泄薪褘屑懈.	脥暮臋卯艌卯膽疟暮 膹毛暮艌贸艌 膷艖 艌艜臋, 梅艌卯谩疟 卯铆膷 谩疟毛膷 盲芒卯茅铆疟臎膷.
91466	-1	68960	DIA_GAERTNER_TEACH_INFO	"AI_OUTPUT(SELF,OTHER,""DIA_Gaertner_Teach_09_03"")"	SUBTITLE	小褉械写懈 胁芯谢芯泻芯薪 斜芯泻芯胁褘褏 褋褌械薪芯泻 褌邪泻卸械 屑芯卸械褌 斜褘褌褜 褋锌褉褟褌邪薪芯 薪械褋泻芯谢褜泻芯 屑芯卸械褌, 芯斜褟蟹邪褌械谢褜薪芯 锌褉芯胁械褉褟泄 褍褌芯谢褖械薪懈褟 懈 蟹邪锌谢邪褌泻懈.	艃膽暮盲膷 芒卯毛卯臋卯铆 谩卯臋卯芒疟艖 艅艌暮铆卯臋 艌艜臋膰暮 臎卯膰暮艌 谩疟艌眉 艅膹膽藱艌艜铆卯 铆暮艅臋卯毛眉臋卯 臎卯膰暮艌, 卯谩藱莽艜艌暮毛眉铆卯 膹膽卯芒暮膽藱茅 贸艌卯毛暖暮铆膷藱 膷 莽艜膹毛艜艌臋膷.
91520	3097	234021	DIA_BILGOT_BEIBRUECKEANGEKOMMEN_INFO	B_SUCCESSMISSION.LASTNODE	LOG_ADDENTRY.PAR1	袦褘 写芯斜褉邪谢懈褋褜 褋 袘懈谢谐芯褌芯屑 写芯 胁褘褏芯写邪 懈蟹 写芯谢懈薪褘 褉褍写薪懈泻芯胁.	臍疟 盲卯谩膽艜毛膷艅眉 艅 脕膷毛膬卯艌卯臎 盲卯 芒疟艖卯盲艜 膷莽 盲卯毛膷铆疟 膽贸盲铆膷臋卯芒.
91878	3098	234398	DIA_HARAD_ABOUTMATERIAL_INFO	B_LOGENTRY.ENTRY	LOG_ADDENTRY.PAR1	袣褍蟹薪械褑 啸邪褉邪写 懈蟹 谐芯褉芯写邪 褋芯芯斜褖懈谢, 褔褌芯 褋械泻褉械褌 屑芯谐褍褌 蟹薪邪褌褜 泻褍蟹薪械褑褘, 芯泻邪蟹邪胁褕懈械褋褟 胁 泻芯谢芯薪懈懈 胁 袛芯谢懈薪械 褉褍写薪懈泻芯胁.	臉贸莽铆暮枚 艕艜膽艜盲 膷莽 膬卯膽卯盲艜 艅卯卯谩暖膷毛, 梅艌卯 艅暮臋膽暮艌 臎卯膬贸艌 莽铆艜艌眉 臋贸莽铆暮枚疟, 卯臋艜莽艜芒艡膷暮艅藱 芒 臋卯毛卯铆膷膷 芒 脛卯毛膷铆暮 膽贸盲铆膷臋卯芒.
92238	3102	234775	DIA_BOSPER_SELLFUR_CONDITION	C_INFO.DESCRIPTION	C_INFO.DESCRIPTION	携 锌褉懈薪械褋 薪械褋泻芯谢褜泻芯 褌芯胁邪褉芯胁 写谢褟 褌械斜褟...	脽 膹膽膷铆暮艅 铆暮艅臋卯毛眉臋卯 艌卯芒艜膽卯芒 盲毛藱 艌暮谩藱...
92242	3102	234779	DIA_BOSPER_SELLFUR_CHOICES	INFO_ADDCHOICE.PAR1	INFO_ADDCHOICE.PAR1	袩褉芯写邪褌褜 褎邪泻械谢褘.	膸膽卯盲艜艌眉 么艜臋暮毛疟.
92243	3102	234780	DIA_BOSPER_SELLFUR_CHOICES	INFO_ADDCHOICE.PAR1	INFO_ADDCHOICE.PAR1	袩褉芯写邪褌褜 锌褉芯褔懈械 褌芯胁邪褉褘.	膸膽卯盲艜艌眉 膹膽卯梅膷暮 艌卯芒艜膽疟.
92944	-1	69665	DIA_MATTEO_LEATHER_UNICK_NEW	"AI_OUTPUT(SELF,OTHER,""DIA_Matteo_LEATHER_09_02"")"	SUBTITLE	协褌懈 写芯褋锌械褏懈 褋褌芯褟褌 薪械写械褕械胁芯, 薪芯 芯薪懈 芯锌褉械写械谢械薪薪芯 褋褌芯褟褌 褋胁芯懈褏 写械薪械谐. 孝邪泻 褔褌芯 胁芯蟹胁褉邪褖邪泄褋褟, 泻芯谐写邪 褍 褌械斜褟 斜褍写械褌 写芯褋褌邪褌芯褔薪芯 蟹芯谢芯褌邪.	Ta zbroja nie jest tania, ale jest warta swojej ceny. Wr贸膰 wi臋c, gdy b臋dziesz mie膰 wystarczaj膮c膮 ilo艣膰 z艂ota.
93083	3108	235643	DIA_MATTEO_SPECWINEDONE_INFO	B_LOGENTRY.ENTRY	LOG_ADDENTRY.PAR1	袦邪褌褌械芯 褋芯芯斜褖懈谢, 褔褌芯 锌芯褋谢械 胁褋褌褉械褔懈 褋 薪懈屑 泻褍褉褜械褉 褍褕械谢 薪芯褔褜褞 泻 褎械褉屑械 袥芯斜邪褉褌邪.	臍艜艌艌暮卯 艅卯卯谩暖膷毛, 梅艌卯 膹卯艅毛暮 芒艅艌膽暮梅膷 艅 铆膷臎 臋贸膽眉暮膽 贸艡暮毛 铆卯梅眉牛 臋 么暮膽臎暮 脣卯谩艜膽艌艜.
93323	3108	235887	DIA_MATTEO_LEATHERFABRIC	C_INFO.DESCRIPTION	C_INFO.DESCRIPTION	袩芯褔械屑褍 褌褘 薪械 锌褉械写谢邪谐邪械褕褜 薪邪褍褔懈褌褜 屑械薪褟 褉邪斜芯褌械 褋 泻芯卸械泄 懈 褌泻邪薪褜褞?	膸卯梅暮臎贸 艌疟 铆暮 膹膽暮盲毛艜膬艜暮艡眉 铆艜贸梅膷艌眉 臎暮铆藱 膽艜谩卯艌暮 艅 臋卯膰暮茅 膷 艌臋艜铆眉牛?
93324	-1	69798	DIA_MATTEO_LEATHERFABRIC_INFO	"AI_OUTPUT(OTHER,SELF,""DIA_Matteo_LeatherFabric_15_00"")"	SUBTITLE	袩芯褔械屑褍 褌褘 薪械 锌褉械写谢邪谐邪械褕褜 薪邪褍褔懈褌褜 屑械薪褟 褉邪斜芯褌械 褋 泻芯卸械泄 懈 褌泻邪薪褜褞?	膸卯梅暮臎贸 艌疟 铆暮 膹膽暮盲毛艜膬艜暮艡眉 铆艜贸梅膷艌眉 臎暮铆藱 膽艜谩卯艌暮 艅 臋卯膰暮茅 膷 艌臋艜铆眉牛?
93325	-1	69798	DIA_MATTEO_LEATHERFABRIC_INFO	"AI_OUTPUT(OTHER,SELF,""DIA_Matteo_LeatherFabric_15_01"")"	SUBTITLE	校 褌械斜褟 胁械写褜 锌褉芯写邪械褌褋褟 懈 芯写械卸写邪, 懈 写芯褋锌械褏懈, 懈 写邪卸械 褕谢褟锌褘 褉邪蟹薪褘褏 褑胁械褌芯胁.	脫 艌暮谩藱 芒暮盲眉 膹膽卯盲艜暮艌艅藱 膷 卯盲暮膰盲艜, 膷 盲卯艅膹暮艖膷, 膷 盲艜膰暮 艡毛藱膹疟 膽艜莽铆疟艖 枚芒暮艌卯芒.
93326	-1	69798	DIA_MATTEO_LEATHERFABRIC_INFO	"AI_OUTPUT(SELF,OTHER,""DIA_Matteo_LeatherFabric_09_01"")"	SUBTITLE	袩芯褌芯屑褍 褔褌芯 写邪卸械 薪褘薪械褕薪懈械 褉邪斜芯褌薪懈泻懈 薪械 蟹邪谐褉褍卸械薪褘.	膸卯艌卯臎贸 梅艌卯 盲艜膰暮 铆疟铆暮艡铆膷暮 膽艜谩卯艌铆膷臋膷 铆暮 莽艜膬膽贸膰暮铆疟.
93327	-1	69798	DIA_MATTEO_LEATHERFABRIC_INFO	"AI_OUTPUT(SELF,OTHER,""DIA_Matteo_LeatherFabric_09_02"")"	SUBTITLE	袣芯谐写邪 胁 锌芯褉褌 蟹邪褏芯写懈谢懈 泻芯褉邪斜谢懈, 薪邪 芯写薪芯泄 锌芯褔懈薪泻械 芯写械卸写褘 屑芯卸薪芯 斜褘谢芯 薪械锌谢芯褏芯 蟹邪褉邪斜芯褌邪褌褜.	臉卯膬盲艜 芒 膹卯膽艌 莽艜艖卯盲膷毛膷 臋卯膽艜谩毛膷, 铆艜 卯盲铆卯茅 膹卯梅膷铆臋暮 卯盲暮膰盲疟 臎卯膰铆卯 谩疟毛卯 铆暮膹毛卯艖卯 莽艜膽艜谩卯艌艜艌眉.
93328	-1	69798	DIA_MATTEO_LEATHERFABRIC_INFO	"AI_OUTPUT(SELF,OTHER,""DIA_Matteo_LeatherFabric_09_03"")"	SUBTITLE	小械泄褔邪褋 卸械 泻褌芯 褋邪屑 写谢褟 褋胁芯械泄 褋械屑褜懈 屑邪褋褌械褉懈褌, 泻褌芯 芯斜屑械薪懈胁邪械褌褋褟 褋 褋芯褋械写褟屑懈.	艃暮茅梅艜艅 膰暮 臋艌卯 艅艜臎 盲毛藱 艅芒卯暮茅 艅暮臎眉膷 臎艜艅艌暮膽膷艌, 臋艌卯 卯谩臎暮铆膷芒艜暮艌艅藱 艅 艅卯艅暮盲藱臎膷.
